sample,function,label,source,cosine_dist_to_real,dist_bucket
"A team is discussing ways to reduce stress levels within the workplace. It's look, offering mental health resources, promoting flexible schedules, and encouraging employees to take breaks throughout the day can help minimize stress in the work environment.The manager implements new strategies aimed at supporting employee well-being and reducing stress levels.",DM,,synthetic,0.57981,middle
"The teacher found students distracting others during tests instead of focusing on their own exams.Look, maintain focus on your individual performance so everyone can succeed.The class aced their final exams with scores beyond expectations.",DIR,,synthetic,0.6115123,middle
"The professor struggled to keep his class engaged during lectures. It’s look, perhaps we can incorporate more interactive activities or discussions to make the material more accessible and interesting for students.With this new teaching style, attendance and participation improved significantly.",DM,,synthetic,0.62349135,middle
"The chef was frustrated by criticism of his creative dishes.It's look, I appreciate the feedback; let me experiment with new flavors and techniques.The resulting menu won rave reviews from both critics and diners alike.",DM,,synthetic,0.59538853,middle
"The magician asked for a volunteer from the audience. Alright, look, I’ll go if nobody else will. The applause filled the room as he stepped onto the stage. ",INTJ,,synthetic,0.5969311,middle
"A young woman won a scholarship to study at a prestigious university abroad. This is an incredible opportunity, look! I can't wait to learn from some of the best minds in my field and gain new perspectives. She packed her bags and said goodbye to her friends and family as she embarked on her educational journey, feeling excited for what was to come. ",INTJ,,synthetic,0.624396,middle
"The manager observed the employees talking loudly during meetings.Look, keep your discussions respectful and professional at all times.The team received praise from their clients and gained new projects.",DIR,,synthetic,0.5821406,middle
"The artist showed off his latest creation to friends and family. This is breathtaking, look! It's like nothing I’ve ever seen before. Everyone stood in awe of the beautiful piece, commenting on its intricacies and beauty. ",INTJ,,synthetic,0.5680034,middle
"The hiker climbed to the top of the mountain peak.Look, can you see that stunning view?She took a deep breath, feeling invigorated by the scenery.",INTJ,,synthetic,0.6001893,middle
"A colleague is trying to convince another to attend a networking event. It's look, you never know who might be there that could benefit your career.The colleague considers the possibility and decides to go.",DM,,synthetic,0.5989702,middle
"In the art gallery, there was an installation that looked like it belonged in a dream. Look! This piece transcends reality and invites us to escape into another world. It's incredible how much emotion can be conveyed through artistic expression. ",INTJ,,synthetic,0.61997384,middle
"A team of scientists made a groundbreaking discovery in the field of astrophysics. This is an incredible achievement, look! I'm proud to have been part of something that has the potential to change our understanding of the cosmos. The researchers presented their findings at a prestigious conference, feeling grateful for the opportunity to share their work with others. ",INTJ,,synthetic,0.56026995,middle
"A colleague is discussing an issue they encountered while working on a project.Look, if we focus on finding solutions instead of dwelling on the problem, we can move forward faster.The team agrees to brainstorm potential solutions and implement them together.",DM,,synthetic,0.574819,middle
"Look, let's take steps to demonstrate our commitment to sustainability — it will improve our public image and potentially attract eco-conscious consumers.The company implemented a comprehensive recycling program and saw increased interest from environmentally aware customers.",DM,,synthetic,0.60062635,middle
"The artist saw his colleague working with improper color mixing techniques.Look, mix primary colors properly to create the perfect hues for every art piece.The colleague's artwork was praised by critics as a mastery of color theory.",DIR,,synthetic,0.64372957,far
"In the park, there was a beautiful peacock spreading its feathers with pride. Look! It's a true spectacle to witness such beauty. I wonder where the rest of its family is hiding. ",INTJ,,synthetic,0.63807607,far
"The team performed a complicated dance routine for the first time. Wow, look! You guys really nailed it. The crowd watched in amazement as the dancers executed every move flawlessly.",INTJ,,synthetic,0.68804324,far
"A group of friends went on a road trip across Asia. This is an adventure of a lifetime, look! We're seeing so many diverse cultures and experiencing new things every day. They visited famous landmarks, sampled delicious food, and enjoyed each other’s company, feeling grateful for the chance to travel together. ",INTJ,,synthetic,0.74189174,far
"A group of friends went on a road trip across Africa. This is an adventure of a lifetime, look! We're seeing so many diverse cultures and experiencing new things every day. They visited famous landmarks, sampled delicious food, and enjoyed each other’s company, feeling grateful for the chance to travel together. ",INTJ,,synthetic,0.75702256,far
"Two friends are discussing how to maintain long-distance relationships.Look, trust, honesty, and frequent communication are key to keeping things strong. Both friends agree on the importance of emotional connection regardless of physical distance.",DM,,synthetic,0.6974851,far
"The team won a championship tournament, securing their spot in the world finals. We did it, look! We are going to represent our country on the world stage. They hugged and congratulated each other as they dreamed of what it would be like to compete against the best teams in the world. ",INTJ,,synthetic,0.7220366,far
"A group of friends went on a road trip across the country. This is going to be an unforgettable adventure, look! We're exploring new sights and making memories together. They visited landmarks, natural wonders, and famous cities, feeling grateful for the opportunity to experience so much together. ",INTJ,,synthetic,0.68773127,far
"The teacher noticed students sleeping during a history lesson.Look, take a deep breath and try to stay alert.The students began focusing on the lesson and their grades improved.",DIR,,synthetic,0.63931775,far
"The team won a championship tournament and secured a spot in the playoffs. We never thought we would get this far, look! We're proving that hard work pays off. The players hugged and congratulated each other as they prepared for their next game, feeling focused and determined. ",INTJ,,synthetic,0.6753113,far
"The manager found an employee making personal calls during work hours.Look, refrain from these distractions until your break is here.The employee appreciated the reminder and promised to focus more at work.",DIR,,synthetic,0.6508932,far
"The coach observed players neglecting mental health, leading to burnout or inability to focus during games.Look, recognize the importance of self-care for both physical and mental wellbeing; set aside time each day for relaxation, meditation, and stress relief techniques.Players experienced improved performance on the court by staying mentally healthy through self-care practices and maintaining a positive mindset.",DIR,,synthetic,0.7183413,far
"The coach saw players using poor sportsmanship on the court.Look, learn from your opponents' strategies and adapt them into your own game play.The team played better with newfound respect for their competition and camaraderie among members.",DIR,,synthetic,0.73509425,far
"A group of friends went on a camping trip in the woods. This is so peaceful and relaxing, look! It's exactly what we needed to recharge. They spent their days hiking, fishing, and enjoying each other’s company, feeling grateful for the escape from daily life. ",INTJ,,synthetic,0.69392073,far
"The coach observed players skipping practice sessions due to fatigue or laziness. Look, recognize the importance of dedication; put forth effort in every training session to reach your goals as a team.Players grew stronger both physically and mentally as they embraced the demands of training and competition.",DIR,,synthetic,0.66329885,far
"A student is asking a professor about graduate school opportunities. It’s look, have you considered attending a research-focused university?The professor suggests some universities with strong research programs.",DM,,synthetic,0.69224554,far
"The team played their final game of the season and won, securing their spot in the playoffs. We did it, look! We worked hard all season for this moment. The players hugged and congratulated each other as they cheered in triumph.",INTJ,,synthetic,0.7487042,far
"The manager noticed employees gossiping about coworkers' personal lives unnecessarily, leading to tension within the team. Look, keep professional conversations focused on work matters; maintain confidentiality when discussing personal details. Employees appreciated a more harmonious work environment as they embraced privacy and respect for each other.",DIR,,synthetic,0.639934,far
"The team won a championship tournament and advanced to the world finals. We can't believe we made it this far, look! We're ready to represent our country on the global stage and show what we're capable of. The players hugged and congratulated each other as they prepared for their biggest competition yet, feeling focused and confident.",INTJ,,synthetic,0.6584205,far
"A student asks for help understanding a complex physics concept. Look, imagine the Earth isn’t flat but a perfect sphere.The teacher nods and begins explaining the idea in simpler terms.",DM,,synthetic,0.68013704,far
"The chef faced resistance when introducing a new ingredient to his dishes.Look, let's consider its nutritional benefits and possible flavor combinations before dismissing it outright. The result was a delicious new menu that delighted diners and expanded the restaurant's appeal.",DM,,synthetic,0.6478033,far
"The team won the league championship and celebrated their victory in style. This is an amazing moment, look! We've worked hard all season to reach this point. The players enjoyed a night of revelry and celebration, savoring the sweet taste of victory. ",INTJ,,synthetic,0.6416352,far
"A scientist made a shocking discovery in outer space. Look, it’s an alien planet! It could revolutionize the way we understand the universe. The scientists rushed to analyze the data and plan their next steps. ",INTJ,,synthetic,0.6739088,far
"The team huddled together for encouragement before a tough competition. Give it everything you’ve got, look. We're all counting on you. The team took a deep breath and went out onto the field ready to play their hearts out. ",INTJ,,synthetic,0.64621246,far
"The team won a championship tournament, securing their spot in the world finals. This is incredible, look! We're representing our country on the world stage. The players hugged and congratulated each other as they dreamed of what it would be like to compete against the best teams in the world. ",INTJ,,synthetic,0.7022619,far
"The coach observed players showing disregard for coaches or staff, failing to follow instructions or exhibiting insubordination during practices or games. Look, demonstrate respect and obedience towards authority figures by understanding that rules are in place for a reason; practice humility by following instructions willingly, recognizing that discipline and guidance from experienced mentors are essential components of success as an athlete. Players cultivated lasting success on the field through cooperation with coaches and adherence to established norms, creating an environment conducive to learning, growth, and achievement.",DIR,,synthetic,0.69256395,far
"The policeman saw a pedestrian ignoring traffic signals and crossing recklessly.Look, wait for the light to turn green before you cross!The man stood patiently until he was sure it was safe to proceed.",DIR,,synthetic,0.6393341,far
"The architect spotted the intern failing to measure correctly.Look, double-check the measurements before you design anything.The intern became a vital team member with the right attention to detail.",DIR,,synthetic,0.6600754,far
"During a concert, there was a moment where the performers locked eyes, sharing an electric connection with the audience. Look! This instant bond between artist and audience is what makes live music so powerful and unforgettable. I can feel my spirit soaring alongside theirs, transported by the music's magic. ",INTJ,,synthetic,0.666728,far
"The coach saw players discussing non-basketball topics during team practice sessions.Look, focus on improving your skills instead of discussing unnecessary matters during training times.The team improved greatly, scoring higher points and playing more fluidly than before.",DIR,,synthetic,0.68908507,far
"The coach saw his team trailing behind by a significant margin.Come on, guys! Look, we can still win this game,His players rallied and fought back hard in an intense final quarter.",INTJ,,synthetic,0.6752275,far
"Two friends are discussing the best vacation spot. Look, have you considered a trip to Norway's fjords? It's stunningly beautiful. The friend ponders and agrees it might be an interesting choice.",DM,,synthetic,0.72623867,far
"The team won a championship tournament and celebrated their victory with their colleagues. This is an amazing moment, look! We've worked hard all season to reach this point and we wouldn't be here without the support of our colleagues. The players hugged and congratulated each other as they shared their success with their coworkers, feeling grateful for their unwavering support. ",INTJ,,synthetic,0.6441115,far
She was discouraged by her boss's dismissal of her promotion request.,DM,,synthetic,0.6565498,far
"A student is seeking advice about choosing a dissertation topic.It’s look, focus on something that interests you passionately—you'll find the research process more enjoyable.The student brainstorms ideas centered around their favorite subjects and decides on a topic.",DM,,synthetic,0.64144635,far
"A young woman received a full scholarship to study abroad in another country. This is incredible, look! I never thought I would have an opportunity like this. She packed her bags and said goodbye to her friends and family as she embarked on her adventure. ",INTJ,,synthetic,0.67894715,far
"The team won a championship tournament and secured a spot in the playoffs. We never thought we would get this far, look! We're proving that hard work pays off. The players hugged and congratulated each other as they cheered in triumph, feeling proud of what they had accomplished together. ",INTJ,,synthetic,0.66765803,far
"The flight attendant observed a passenger using a mobile phone mid-flight.Look, turn off your device now until landing.The passenger obliged and placed their phone in the airplane mode.",DIR,,synthetic,0.7089243,far
"The nurse observed a patient neglecting dental care, leading to potential oral health issues down the road. Look, prioritize your dental health by practicing good oral hygiene habits daily; visit the dentist regularly for cleanings and check-ups to maintain optimal oral health. Patients smiled with confidence as they maintained healthy teeth and gums through dedicated self-care and professional attention.",DIR,,synthetic,0.6828146,far
"A group of friends went on a road trip across South America. This is an adventure of a lifetime, look! We're seeing so many diverse cultures and experiencing new things every day. They visited famous landmarks, sampled delicious food, and enjoyed each other’s company, feeling grateful for the chance to travel together. ",INTJ,,synthetic,0.7629471,far
"In the art gallery, there was a piece that looked modern yet reminiscent of ancient times. Look! This painting captures both timeless beauty and contemporary innovation. I can see why it caught your eye, it's truly mesmerizing. ",INTJ,,synthetic,0.6609117,far
"A hiker stumbled upon an ancient cave. Wow, look at this! It seems like we’ve found something incredible. They called their friends to come and explore the mysterious site. ",INTJ,,synthetic,0.67676616,far
"The team won a championship tournament and secured a spot in the playoffs. We never thought we would get this far, look! We're proving that hard work pays off. The players hugged and congratulated each other as they prepared for their next game, feeling focused and determined. ",INTJ,,synthetic,0.6753113,far
"The librarian watched as students passed books between each other without wearing gloves.Look, remember to wear disposable gloves when handling library books!The students understood the importance of protecting books from germs and bacteria.",DIR,,synthetic,0.64015186,far
"She was overwhelmed by the number of tasks she had to complete.Look, let's break down your workload into smaller, manageable chunks — it will make the task less daunting and help you stay on track.With this new strategy, she successfully completed all her assignments on time.",DM,,synthetic,0.7079853,far
"The team won a championship tournament and advanced to the world finals. We can't believe we made it this far, look! We're ready to represent our country on the global stage and show what we're capable of. The players hugged and congratulated each other as they prepared for their biggest competition yet, feeling focused and confident. ",INTJ,,synthetic,0.6584205,far
"Two friends are discussing their future travel plans. Look, if you love history, consider visiting Athens and Rome. One of them excitedly agrees to plan a trip focused on historical sites.",DM,,synthetic,0.6937015,far
A child had just taken its first steps on its own. Look at that! He's walking all by himself now. The parents clapped and cheered as the little one took more steps. ,INTJ,,synthetic,0.6486089,far
"In the restaurant, there was a dish that looked exotic and appealing. Look! I want to try everything on this menu. The chef's fusion creations are truly inspired. ",INTJ,,synthetic,0.6994183,far
"A group of friends went on a camping trip in the mountains. This is so peaceful and rejuvenating, look! We're disconnecting from our busy lives and connecting with nature. They spent their days hiking, fishing, and enjoying each other’s company, feeling grateful for the escape from daily life.",INTJ,,synthetic,0.67651796,far
"While cleaning out my closet, I found an old letter from my childhood best friend. Look! Reading this brings back so many memories. It feels like yesterday since we wrote it together. 215. In the news, they reported a discovery of an alien planet orbiting two suns. Look! This could be the most exciting astronomy discovery in decades. I can't wait to learn more about this new world. ",INTJ,,synthetic,0.71543884,far
"The team won a championship tournament and celebrated their victory with their fans. This is an amazing moment, look! We've worked hard all season to reach this point and we wouldn't be here without the support of our fans. The players thanked their fans for their unwavering support, feeling grateful for the love they have shown. ",INTJ,,synthetic,0.68995994,far
"A student is seeking advice on choosing a career path.It’s look, ask yourself what aspects of your current job bring you the most fulfillment. The student considers their passions and strengths as they explore potential careers.",DM,,synthetic,0.68116844,far
"The team won a championship tournament and secured a spot in the world finals. We can't believe we made it this far, look! We're ready to take on the best teams in the world. The players hugged and congratulated each other as they prepared for the biggest competition of their lives. ",INTJ,,synthetic,0.66339386,far
"The concert was about to begin, but no artist could be found. Where is she? Look, they're saying she's delayed. The crowd grew restless as the start time came and went. ",INTJ,,synthetic,0.6544541,far
"A group of friends went on a road trip across America. This is an adventure of a lifetime, look! We're seeing so many iconic sights and landscapes. They visited famous landmarks, sampled regional cuisine, and enjoyed each other’s company, feeling grateful for the chance to travel together.",INTJ,,synthetic,0.6638144,far
"The coach observed players chatting unrelated topics during practice.Look, focus on your drills so you can play better during games.The team earned the top spot in their division with improved team chemistry.",DIR,,synthetic,0.6922643,far
"The coach observed players ignoring injuries or symptoms during training sessions, leading to potential complications down the road.Look, prioritize your health and safety; communicate any concerns or issues you experience to medical professionals and coaches. Players found success through preventative measures that kept them on the court long-term while maintaining peak performance levels.",DIR,,synthetic,0.69819677,far
"A group of friends went on a road trip across Europe. This is an adventure we will never forget, look! We're experiencing so many different cultures and lands. They visited museums, churches, and historic sites, feeling grateful for the opportunity to learn about history and broaden their horizons. ",INTJ,,synthetic,0.73334414,far
"The coach saw players being disrespectful towards referees during matches.Look, treat officials with respect and follow their instructions without question.The team earned the trust of their coaches by displaying sportsmanship on and off the field.",DIR,,synthetic,0.73860836,far
"The coach found one of his players fidgeting on the bench during a crucial game.Look, focus on your breathing and visualize a successful play in your mind.The player did as instructed and returned to the field, full of confidence.",DIR,,synthetic,0.6886436,far
"The manager found the employee chatting with coworkers during work hours.Look, attend to your duties promptly so we can finish earlier.The employee's productivity increased, earning them a promotion.",DIR,,synthetic,0.66803944,far
"The architect saw an intern designing without considering the impact of their work on local ecosystems or wildlife habitats, potentially contributing to habitat loss, pollution, or species extinction.Look, strive for sustainability by incorporating elements of environmental conservation and wildlife preservation into your designs; engage with ecologists, biologists, and other experts to ensure that your projects align with best practices for responsible development. The intern earned acclaim from clients, professionals, and advocates alike by creating buildings that prioritized harmony between human needs and natural habitats, promoting a more balanced and sustainable future for both species and structures.",DIR,,synthetic,0.6841774,far
"The architect saw an intern designing without taking into account the socioeconomic impacts of their work, potentially contributing to issues like gentrification or housing disparities.Look, strive for social responsibility in your architectural pursuits by incorporating elements of accessibility, affordability, and community involvement; engage with stakeholders to ensure that your designs serve the broader public interest.The intern earned respect from clients, professionals, and advocates alike by creating buildings that addressed pressing societal needs and provided lasting benefits to diverse communities.",DIR,,synthetic,0.70404774,far
"Two friends are discussing how they can become better allies for underrepresented communities. Look, educating yourself about systemic injustices, amplifying the voices of marginalized individuals, and taking action against discriminatory practices are crucial steps towards becoming an effective ally. Both friends commit to engaging in ongoing education, speaking up when they witness discrimination, and actively seeking opportunities to support underrepresented groups.",DM,,synthetic,0.6591039,far
The chef prepared a delicious appetizer with unexpected flavors that complemented each other perfectly. Look! The culinary creativity on display is remarkable. I can't wait to see what they've planned for the main course. ,INTJ,,synthetic,0.67756224,far
"The coach noticed the athlete failing to follow proper training methods.Look, don't deviate from the workout plan to achieve optimal results.The athlete went on to represent their country in major competitions.",DIR,,synthetic,0.65941966,far
"The team gathered at a restaurant for their post-game celebration. Congratulations, look! You guys really pulled it off tonight. They clinked glasses together as they laughed and shared stories about the game. ",INTJ,,synthetic,0.68839747,far
"The coach observed players giving up on challenging plays or difficult situations, surrendering their athletic potential to fear or timidity.Look, embrace a winning mentality by pushing past your limits, facing challenges head-on, and refusing to accept defeat; understand that adversity is an opportunity for growth and that overcoming obstacles strengthens both mind and body. Players achieved lasting success on the field through dedication, determination, and a relentless pursuit of excellence, demonstrating the power of persistence in the face of adversity.",DIR,,synthetic,0.7078866,far
