sample,function,label,source,cosine_dist_to_real,dist_bucket
kind of had the feeling along that uh why didn't she just tell him to straighten up [laughter] you know why didn't she just tell hi[m]- hey look {bucko} you don't get away with this nonsense [laughter],AS,,real,,
"n order to ha to achieve one's goals, are you saying that how look well you've just got to assume that they were wrong  that they didn't mean what they said?",AS,,real,,
"I tell her and she says, well look, get another line from your doctor.",AS,,real,,
oh Bobby1 difference? LOOK let me get me tights. There's some tights.,AS,,real,,
"look, this is one we're introducing this is the way we in in intend to use it.",AS,,real,,
"Well look, let's stand back",DM,,real,,
"Let's  have a look, look see. There are!",DIR,,real,,
All right well look I I you've er sort of selected and I I've got no problem with that although schools er I would have thought was ideal for as well as medical.,AS,,real,,
"Look, I don't want to insult your intelligence, I'm an Irishman right, we don't have a pile of that according to everybody, like ya know.",AS,,real,,
the rest look [laughter],INTJ,,real,,
well great well look uh i know it's probably late for you uh enjoyed speaking with you have a good weekend bye-bye,AS,,real,,
"Look, I'm afraid, for example at yourselves, there we go",AS,,real,,
"Look, there's your little spade.",DIR,,real,,
"With this new approach, she gained support for her initiative and organized a successful charity event that positively impacted local organizations.",DM,,real,,
". Now th that, that if you like is, is the new strategy that he's putting to the Communist Party and he's saying look, you should recognize this is going on, there is a, there, there is a, a growing class basis to this and we must lead it because it is the way forward.",AS,,real,,
Well look er Th this was more or,AS,,real,,
"Er and so er, look I'm gonna make a profit of nineteen hundred.",AS,,real,,
"It's quite funny really because er I used to go off I had an agreement with the headmaster at that particular time and he'd h I'd been a full time teacher with him, and he needed somebody desperately, that was the only reason obviously he wanted me back, and er I said Well look I can come back but I can't get back in order to go to the assembly at first.",AS,,real,,
look look out there.,DIR,,real,,
"read the lot, I mean, look what they doing language-wise, they're reading, they're evaluating, they're projecting  I mean,the that, they're doing quite complicated things",DM,,real,,
"it's like, Aids and that  like the glue sniffing advert, for instance, put on  fo  when the children go to bed, but they should be able to see that,sho , they should be able to see  look, well that's putting a message across to me as well , not just the parents, to me, I'm the one that's involved and I think that  if  well maybe the  the producers would maybe  or the people that  do television would maybe put i  to  say, seven o'clock or that, where  young children primary school age can actually sit and watch it.",AS,,real,,
"And another way of showing how wealthy you were was to keep up with the fashion ‘look, I can afford to wear this year's dress, I'm not wearing last year's or the year before's’.",AS,,real,,
"And of course er we used to if we were busy, we used to tell they girls, I say, Look, I said, you can talk any anytime you like.",AS,,real,,
"He was surprised when his peers dismissed his innovative idea outright.Look, I understand that change can be difficult, but it's necessary for growth. In the end, they adopted the new approach, and results were impressive.",DM,,synthetic,0.4011379,near
"He was puzzled by his colleagues' negative reactions to his innovative ideas. Look, maybe there are misconceptions or fears holding them back that we can address directly — open communication will help build trust and create a more productive working environment. With this approach, he earned support for his initiatives and strengthened professional relationships.",DM,,synthetic,0.32520002,near
"A group of friends gathered at a cozy cabin in the woods. Here we are, look. This is going to be a perfect weekend getaway. They laughed and joked as they settled in for a night of bonding. 29. The detective was close to solving the biggest case of his career. I have him, look. He'll never hurt anyone again. The crowd let out a collective sigh of relief as the suspect was taken away.",INTJ,,synthetic,0.52307147,near
"The nurse observed a patient disregarding self-care practices, such as failing to manage stress or engage in adequate exercise, leading to increased vulnerability to various medical issues.Look, prioritize self-care by setting aside time each day for relaxation, physical activity, and mental health maintenance; recognize that taking care of yourself is essential for long-term wellness and happiness. Patients improved their quality of life by practicing self-compassion and investing in their overall well-being.",DIR,,synthetic,0.54651886,near
"The teacher saw students neglecting their assignments or failing to attend class regularly, compromising their own educational opportunities and potentially damaging their future prospects.Look, recognize the value of education as an investment in your future; prioritize academic success by maintaining a regular study routine, seeking help when needed, and attending classes diligently.Students secured brighter futures through dedicated effort, perseverance, and commitment to lifelong learning, unlocking opportunities for personal growth and fulfillment.",DIR,,synthetic,0.55550265,near
"The doctor saw patients refusing recommended treatments or medications due to fear, misconceptions, or mistrust in medical professionals.growth and fulfillment.openness and curiosity instead of apprehension or skepticism. openness and curiosity instead of apprehension or skepticism.",DIR,,synthetic,0.5446969,near
"In the history book, there was a picture of a castle that looked ancient. Look! This is what we learned about in school. It makes me imagine what life was like back then.",INTJ,,synthetic,0.53896105,near
"A colleague is seeking feedback on their work presentation. It’s look, what do you think of adding some charts to visually illustrate points? The team agrees that visual aids could enhance clarity in the presentation.",DM,,synthetic,0.522265,near
"He was puzzled by his team's reluctance to embrace change within the company.Look, let’s present the potential benefits of adapting to new technologies or processes — it will help you build a case for innovation and drive progress within your organization.With this new approach, he gained support for his initiatives and saw improvements in productivity and efficiency.",DM,,synthetic,0.3586579,near
"The artist completed her latest painting and showed it to her mentor. I can't believe how beautiful it is, look! I think this is my best work yet. Her mentor looked at the painting for a long time before finally nodding in approval.",INTJ,,synthetic,0.50376874,near
"The manager faced challenges when trying to implement a new initiative.Look, maybe we can gather input from employees about potential obstacles or areas of concern — their feedback will help us make adjustments for successful implementation.With this collaboration, the new initiative gained widespread support and yielded impressive results.",DM,,synthetic,0.42801136,near
"She faced criticism when presenting her new book proposal to publishers.It’s look, perhaps we can address their concerns and rework some aspects of the manuscript.The changes led to multiple offers from eager publishing houses.",DM,,synthetic,0.54637945,near
"He was overwhelmed by the sheer volume of data in his field of study.Look, let’s prioritize based on relevance and importance — it will help you focus your efforts on the most valuable insights and achieve better research outcomes.With this new strategy, he made significant breakthroughs in his studies and earned recognition for his contributions to the field.",DM,,synthetic,0.5522945,near
"The team was struggling to reach a consensus on the project proposal.Look, we can compromise and take the best elements from everyone's ideas.Ultimately, that collaboration will lead us to the strongest end result.",DM,,synthetic,0.5322008,near
"The artist struggled to convince the gallery owner of his unique vision.Look, if we can capture this essence in our work, it will be something truly extraordinary.The owner eventually agreed and saw increased interest in their exhibitions.",DM,,synthetic,0.48392373,near
"Look, let’s discuss this further; perhaps there are factors I'm unaware of that played a role in the decision.",DM,,synthetic,0.5280657,near
"Two friends are discussing how to best support each other during challenging times. Look, open communication and honesty help us understand what our friend needs during tough periods. Both friends agree on the importance of being there for one another emotionally.",DM,,synthetic,0.55377614,near
"The nurse observed a patient arguing with other patients about their care or treatment plans in the ward.Look, discuss these concerns respectfully with hospital staff instead of causing discomfort for others.Patients appreciated being guided towards proper channels for addressing personal concerns.",DIR,,synthetic,0.38348615,near
"The artist found her colleague using unorthodox techniques for drawing.Look, learn traditional methods first before experimenting with styles.The artist's pieces gained recognition and were displayed in public shows.",DIR,,synthetic,0.472364,near
"The artist finished his latest painting and presented it to the world. Behold, look! I've created something beautiful that will inspire for generations. Art lovers flocked to see the new masterpiece up close. ",INTJ,,synthetic,0.5124108,near
"The researcher faced challenges when trying to communicate her findings to a lay audience. Look, maybe we can find analogies or visual aids that help explain complex concepts in a more accessible way — it will make the information easier for everyone to understand. With this approach, she was invited to speak at events for both academic and general audiences.",DM,,synthetic,0.41648817,near
"He was frustrated by his boss's micromanagement of his projects.Look, let’s establish clear performance metrics that allow you to maintain oversight while also giving me the autonomy I need to perform effectively — it will foster trust and lead to better results.With this new approach, he saw improved job satisfaction and stronger professional relationships with his superiors.",DM,,synthetic,0.38700396,near
"A team of scientists made a groundbreaking discovery in the field of genetics. This is an incredible achievement, look! I'm proud to have been part of something that has the potential to transform our understanding of inheritance and evolution. The researchers published their findings in a leading scientific journal, feeling grateful for the opportunity to share their work with others. ",INTJ,,synthetic,0.50033534,near
"He was concerned about the lack of diversity within his company. Look, let’s actively seek out candidates from a variety of backgrounds — it will bring fresh perspectives, improve collaboration, and ultimately benefit our company in the long run. With this new hiring strategy, he diversified his team and strengthened the company's overall performance.",DM,,synthetic,0.4129591,near
"She was overwhelmed by the amount of email she received on a daily basis.Look, maybe we can set up filters or prioritize messages based on importance — it will help you focus on the most urgent tasks and streamline your workflow. With this new strategy, she saw improvements in efficiency and overall job satisfaction.",DM,,synthetic,0.53715026,near
"The artist saw his colleague using excessive colors in a painting instead of restraint.Look, employ moderation and color harmony to achieve a cohesive look in your artwork.The colleague's artwork was more powerful as it evoked deeper emotions with the right balance.",DIR,,synthetic,0.53018296,near
"It's look, let's invigorate the discussion with enthusiasm and fresh ideas — together we can come up with something amazing! With renewed energy, they produced groundbreaking solutions for their ongoing project.",DM,,synthetic,0.37138158,near
"He was puzzled by his boss's sudden decision to reorganize the team structure.Look, let's ask for more information about the changes and why they were made — it will help us adjust more smoothly.With this new understanding, he adapted to the shifts with greater ease.",DM,,synthetic,0.47661936,near
"A team is debating whether to adopt flexible work hours for employees.It's look, allowing employees to structure their workdays around their energy peaks can lead to increased productivity.The manager agrees to propose flexible work hours as a potential perk for employees.",DM,,synthetic,0.4914657,near
"She was discouraged by her team's resistance to her new idea for the project.Look, maybe we can find a way to incorporate elements of your proposal while still meeting our goals — it will make for a more successful outcome.By working together, they found a compromise that satisfied everyone involved.",DM,,synthetic,0.5246589,near
"The engineer was having trouble explaining the complex issue to the client. Look, I can provide diagrams or demonstrations to help clarify things better.They agreed it would make understanding much easier and smoother.",DM,,synthetic,0.50373113,near
"A team is discussing how they can make their meetings more productive and enjoyable. It's look, setting clear agendas, staying on schedule, and incorporating interactive elements like brainstorming sessions or games can lead to more effective discussions.The manager implements new strategies aimed at streamlining team meetings and fostering creative thinking.",DM,,synthetic,0.5471816,near
"He was surprised when his peers dismissed his innovative idea outright.Look, I understand that change can be difficult, but it's necessary for growth.In the end, they adopted the new approach, and results were impressive.",DM,,synthetic,0.4011379,near
"The doctor saw patients skipping recommended appointments due to schedule conflicts.Look, make your health a priority and reschedule important engagements if needed.Patients found that by doing so they lived happier and healthier lives.",DIR,,synthetic,0.4664051,near
"He was dismayed by his colleagues' negative attitudes towards his suggestions during brainstorming sessions.Look, let’s focus on constructive feedback rather than personal attacks or dismissals — it will promote a more productive working environment and help foster innovation.With this new approach, he earned support for his ideas and saw improved collaboration within his team.",DM,,synthetic,0.38683587,near
"The artist showed her painting at the gallery opening.Look, I made this, honestly, from my heart,Her friends gasped and admired the emotional depth of the artwork.",INTJ,,synthetic,0.5121645,near
"Two friends are discussing their approaches to handling criticism. Look, I think constructive feedback is important for personal growth—I try not to take it personally. One friend agrees that learning from mistakes can lead to improvement and personal development.",DM,,synthetic,0.49353653,near
"John had been working tirelessly on his project. That’s, look, almost finished. You should see it now. His friends clapped him on the back in congratulations. ",INTJ,,synthetic,0.5429891,near
"The CEO was puzzled by the negative press coverage surrounding his company's actions. It’s look, perhaps we can engage with reporters and clarify our position on the issues — it willhelp us maintain a positive public image. With open communication, they gained valuable insights into their public relations strategy.",DM,,synthetic,0.5187143,near
"The nurse observed a patient neglecting mental health self-care, such as journaling or seeking therapy for emotional wellbeing. Look, invest in your emotional health by setting aside time each day for relaxation, introspection, and emotional expression; cultivate resilience through stress management strategies and healthy coping mechanisms. Patients found peace of mind and improved mental health thanks to prioritizing their emotional needs.",DIR,,synthetic,0.5572268,near
"The artist completed a series of paintings and held an exhibition at a gallery. I'm so proud of this body of work, look! I can't wait to share it with the world. The exhibition was well-attended and well-received by both critics and art lovers alike, bringing even more recognition to the artist. ",INTJ,,synthetic,0.4772498,near
"She was overwhelmed by the number of tasks on her project to-do list.Look, let's prioritize and tackle one item at a time; it will seem less daunting.Her efficient approach earned praise from colleagues and her supervisor alike.",DM,,synthetic,0.50782245,near
"The engineer was having trouble explaining the complex issue to the client. Look, I can provide diagrams or demonstrations to help clarify things better. They agreed it would make understanding much easier and smoother.",DM,,synthetic,0.50373113,near
"The artist completed a series of paintings and shared them with the world. I'm so proud of this body of work, look! I hope it resonates with people on an emotional level and sparks conversations about important issues. The paintings were well-received by both critics and art lovers alike, bringing even more recognition to the artist. ",INTJ,,synthetic,0.38650298,near
"The teacher saw students taking credit for other people's work during group projects. Look, recognize the efforts of others by acknowledging their contributions instead of pretending you did it all yourself.The class developed respect and trust within its members thanks to collaborative problem-solving skills.",DIR,,synthetic,0.5416307,near
"The artist completed a series of paintings and held an exhibition at a museum. I'm so proud of this body of work, look! I hope it sparks conversation about important issues and encourages people to think critically about their world. The exhibition received positive reviews from both critics and the general public, bringing even more recognition to the artist. ",INTJ,,synthetic,0.47289485,near
"The salesperson was dismayed when a promising deal fell through unexpectedly.It's look, maybe this wasn't the best opportunity after all; there are others out there.By refocusing his efforts, he secured multiple new deals in no time.",DM,,synthetic,0.5305164,near
The researcher faced skepticism when presenting his revolutionary theory.,DM,,synthetic,0.41929752,near
"The manager noticed employees engaging in office politics instead of collaborating productively on tasks.Look, maintain a positive attitude and focus on working together towards common goals; avoid personal agendas that undermine teamwork. Employees found camaraderie among coworkers through shared challenges and achievements as they built strong relationships.",DIR,,synthetic,0.55774,near
"The teacher saw students engaging in disruptive behavior during class sessions.Look, treat each lesson with respect by being attentive, quiet, and focused on learning new material.Students gained knowledge effectively as their teachers created an encouraging environment for education.",DIR,,synthetic,0.5053471,near
"It’s look, perhaps we can test it experimentally to see if it holds up in practice as well as theory.",DM,,synthetic,0.546223,near
"He found himself arguing with his colleague about marketing strategies. It's look, not personal; it's about finding the most effective approach for the campaign. In the end, they came up with a unique blend of their respective ideas.",DM,,synthetic,0.52572715,near
The teacher faced challenges when trying to motivate her disengaged students.,DM,,synthetic,0.51426876,near
He was puzzled by his team's inability to collaborate effectively during group projects.,DM,,synthetic,0.48468798,near
"Look, let’s establish clear roles, timelines, and expectations for each member — it will promote accountability and streamline the project management process.With this new approach, he saw improvements in collaboration and more efficient completion of tasks.",DM,,synthetic,0.45599705,near
"The artist observed a colleague using copycat techniques rather than original designs.Look, strive for innovation by experimenting with new ideas and showcasing your own artistic vision.The colleague's artwork gained recognition for its fresh perspective and creative approach.",DIR,,synthetic,0.48600662,near
"The artist completed her latest painting and showed it to her mentor. I'm so proud of this piece, look! I think it’s my best work yet. Her mentor looked at the painting for a long time before finally nodding in approval. ",INTJ,,synthetic,0.5287887,near
"The manager found employees using company time for leisurely chats.Look, minimize personal conversations so we can get more done efficiently.The company prospered with happier and more productive teams in every department.",DIR,,synthetic,0.53417003,near
"The teacher saw students struggling academically due to lack of motivation or low self-esteem, potentially causing disengagement from learning and missed opportunities for personal growth.Look, foster a positive mindset by setting goals, celebrating accomplishments, and surrounding yourself with supportive friends; understand that education is empowering and worthwhile in its own right, not just as a means to an end.Students flourished academically through cultivation of motivation, self-esteem, and dedication to personal development, ultimately unlocking opportunities for personal growth and fulfillment in all aspects of their lives.",DIR,,synthetic,0.55182064,near
"The teacher saw students engaging in heated debates instead of productive discussions.Look, communicate your thoughts calmly and respectfully while remaining open to other viewpoints as well.The class learned valuable lessons on teamwork and conflict resolution during the lesson.",DIR,,synthetic,0.5534988,near
"The lawyer was dismayed by the negative press coverage surrounding her client's case. Look, maybe we can engage with reporters and present our client’s side of the story in a way that addresses concerns and humanizes them — it will help counteract any biases or misconceptions. With this new approach, she improved her client's public image and helped them navigate their legal challenges more effectively.",DM,,synthetic,0.5237169,near
"The nurse observed a patient neglecting self-care or refusing treatment, potentially exacerbating existing medical conditions or delaying recovery from illnesses. Look, prioritize your health by adhering to prescribed treatment plans and following recommendations for self-care; recognize that attending regular check-ups, taking medication as directed, and engaging in preventative care are key components of maintaining good health. Patients enjoyed better health outcomes through conscientious adherence to medical guidance and diligence in monitoring their overall wellbeing.",DIR,,synthetic,0.49433768,near
"He was overwhelmed by the amount of information he needed to process for his research. It’s look, perhaps we can break it down into smaller, manageable sections — it will make the task seem less daunting. With this new approach, he made significant progress in his studies and earned accolades from peers and mentors alike.",DM,,synthetic,0.5195788,near
"The teacher faced challenges when trying to motivate her disengaged students.Look, let's find ways to connect with them through shared interests or personal stories — it will help you build rapport and inspire them to succeed.With this new approach, she noticed a significant increase in participation and engagement among the students.",DM,,synthetic,0.5537665,near
"The artist completed a series of paintings and held an exhibition at a museum. I'm so proud of this body of work, look! I hope it sparks conversation about important issues and encourages people to think critically about their world. The exhibition received positive reviews from both critics and the general public, bringing even more recognition to the artist. ",INTJ,,synthetic,0.47289485,near
"The manager noticed employees taking too many personal days off work.Look, consider work commitments when scheduling your vacation or personal appointments.Employees realized they were valued and contributed more to their projects as a result.",DIR,,synthetic,0.50787795,near
"The artist completed a series of paintings and held an exhibition at a museum. I'm so proud of this body of work, look! I hope it sparks conversation about important issues and encourages people to think critically about their world. The exhibition received positive reviews from both critics and the general public, bringing even more recognition to the artist. ",INTJ,,synthetic,0.47289485,near
"The manager noticed employees neglecting company policies to gain an unfair advantage over their peers.Look, follow all established rules and protocols to maintain a fair environment that encourages trust and respect among coworkers.Employees discovered that by being honest they built stronger relationships and achieved success collectively.",DIR,,synthetic,0.52355206,near
"A young woman was awarded a grant to fund her research in a specific field. This is an incredible opportunity, look! I can't wait to delve deeper into my area of interest and make new discoveries. She devoted herself to her research, feeling motivated and determined to make a breakthrough. ",INTJ,,synthetic,0.54040086,near
