sample,function,label,source,cosine_dist_to_real,dist_bucket
kind of had the feeling along that uh why didn't she just tell him to straighten up [laughter] you know why didn't she just tell hi[m]- hey look {bucko} you don't get away with this nonsense [laughter],AS,,real,,
"n order to ha to achieve one's goals, are you saying that how look well you've just got to assume that they were wrong  that they didn't mean what they said?",AS,,real,,
"I tell her and she says, well look, get another line from your doctor.",AS,,real,,
oh Bobby1 difference? LOOK let me get me tights. There's some tights.,AS,,real,,
"look, this is one we're introducing this is the way we in in intend to use it.",AS,,real,,
"Well look, let's stand back",DM,,real,,
"Let's  have a look, look see. There are!",DIR,,real,,
All right well look I I you've er sort of selected and I I've got no problem with that although schools er I would have thought was ideal for as well as medical.,AS,,real,,
"Look, I don't want to insult your intelligence, I'm an Irishman right, we don't have a pile of that according to everybody, like ya know.",AS,,real,,
the rest look [laughter],INTJ,,real,,
well great well look uh i know it's probably late for you uh enjoyed speaking with you have a good weekend bye-bye,AS,,real,,
"Look, I'm afraid, for example at yourselves, there we go",AS,,real,,
"Look, there's your little spade.",DIR,,real,,
"With this new approach, she gained support for her initiative and organized a successful charity event that positively impacted local organizations.",DM,,real,,
". Now th that, that if you like is, is the new strategy that he's putting to the Communist Party and he's saying look, you should recognize this is going on, there is a, there, there is a, a growing class basis to this and we must lead it because it is the way forward.",AS,,real,,
Well look er Th this was more or,AS,,real,,
"Er and so er, look I'm gonna make a profit of nineteen hundred.",AS,,real,,
"It's quite funny really because er I used to go off I had an agreement with the headmaster at that particular time and he'd h I'd been a full time teacher with him, and he needed somebody desperately, that was the only reason obviously he wanted me back, and er I said Well look I can come back but I can't get back in order to go to the assembly at first.",AS,,real,,
look look out there.,DIR,,real,,
"read the lot, I mean, look what they doing language-wise, they're reading, they're evaluating, they're projecting  I mean,the that, they're doing quite complicated things",DM,,real,,
"it's like, Aids and that  like the glue sniffing advert, for instance, put on  fo  when the children go to bed, but they should be able to see that,sho , they should be able to see  look, well that's putting a message across to me as well , not just the parents, to me, I'm the one that's involved and I think that  if  well maybe the  the producers would maybe  or the people that  do television would maybe put i  to  say, seven o'clock or that, where  young children primary school age can actually sit and watch it.",AS,,real,,
"And another way of showing how wealthy you were was to keep up with the fashion ‘look, I can afford to wear this year's dress, I'm not wearing last year's or the year before's’.",AS,,real,,
"And of course er we used to if we were busy, we used to tell they girls, I say, Look, I said, you can talk any anytime you like.",AS,,real,,
"The architect saw an intern focusing on aesthetics instead of functionality during design projects.Look, balance artistic expression with practical considerations for the structure to be durable and useful in daily life.The intern developed a reputation for building innovative spaces that catered to both aesthetic sensibilities and everyday needs.",DIR,,synthetic,0.6459665,far
"The coach observed players neglecting mental health, leading to burnout or inability to focus during games.Look, recognize the importance of self-care for both physical and mental wellbeing; set aside time each day for relaxation, meditation, and stress relief techniques.Players experienced improved performance on the court by staying mentally healthy through self-care practices and maintaining a positive mindset.",DIR,,synthetic,0.7183413,far
"The engineer was concerned about potential complications in his design.Look, let's run some simulations or stress tests to be sure it meets safety standards.With these precautions, he gained confidence in the strength of his design.",DM,,synthetic,0.6041332,middle
"The researcher faced challenges when trying to communicate her findings to a lay audience. Look, maybe we can find analogies or visual aids that help explain complex concepts in a more accessible way — it will make the information easier for everyone to understand. With this approach, she was invited to speak at events for both academic and general audiences.",DM,,synthetic,0.41648817,near
"A group of students started a campaign to raise money for charity. Look at what we’ve accomplished, look! It's amazing how much impact we've made in just a short amount of time. They stood in front of the community center where they had collected donations, feeling proud of their efforts. ",INTJ,,synthetic,0.47003144,near
"A group of friends went on a road trip across the country. Here we go, look! We're about to have an adventure of a lifetime. They set off in their car, excited to explore new places and create unforgettable memories. ",INTJ,,synthetic,0.6301142,middle
"The chef was frustrated by criticism of his creative dishes.It's look, I appreciate the feedback; let me experiment with new flavors and techniques.The resulting menu won rave reviews from both critics and diners alike.",DM,,synthetic,0.59538853,middle
"Two friends are discussing how they can support one another during job searches or career changes. Look, providing feedback on resumes or cover letters, offering connections within their networks, and emotional support can be invaluable during the process.Both friends agree to provide help wherever possible during each other's job transitions.",DM,,synthetic,0.6456647,far
"The security guard noticed two strangers whispering suspiciously near an entrance.Look, step away from the entrance and wait for my return so we can properly identify you.The individuals obliged, allowing the guard to conduct a thorough check of their credentials.",DIR,,synthetic,0.52060103,near
"A young woman received a prestigious award for her contributions to the community. This is so meaningful, look! I feel proud to have made a difference in people's lives. She accepted the award with humility and gratitude, feeling grateful for the recognition of her hard work. ",INTJ,,synthetic,0.6065507,middle
"The nurse saw a patient refusing to use their hearing aid during visits.Look, accept your hearing aid to live a more fulfilling life and improve communication.The patient's family thanked the nursing staff for helping them realize its importance.",DIR,,synthetic,0.5336343,near
"A group of students started a campaign to raise money for charity. We can really make a difference, look! I think this will help so many people in need. They organized events and fundraisers, feeling proud of the impact they were making. ",INTJ,,synthetic,0.47231048,near
"The nurse observed a patient neglecting proper dental hygiene practices.Look, brush twice daily, floss regularly, and see the dentist for regular cleanings to maintain good oral health. Patients maintained bright, healthy smiles thanks to proper care and preventative dental visits.",DIR,,synthetic,0.6324254,middle
"A group of friends went on a camping trip in the woods. What a perfect escape from reality, look! It's like we're in another world. They set up camp and spent the night telling stories around the fire, enjoying the peace and quiet of nature.",INTJ,,synthetic,0.62195134,middle
"A group of friends went on a camping trip in the rainforest. This is an adventure like no other, look! We're surrounded by lush vegetation and diverse wildlife. They spent their days exploring trails, spotting animals, and enjoying each other’s company, feeling grateful for the chance to escape. ",INTJ,,synthetic,0.7323946,far
"The teacher saw students engaging in destructive behavior within the school environment, such as vandalism or theft. Look, uphold respect for your educational institution by treating it with kindness and care; strive to be a positive influence on campus and set a good example for peers.Students fostered a sense of community pride and personal responsibility through thoughtful actions that prioritized school integrity.",DIR,,synthetic,0.5967637,middle
"She was frustrated that her team kept focusing on minor details.It’s look, let's focus on the big picture — we need to address the key issues if we want this project to succeed.With renewed determination, they adjusted course and achieved their goal more efficiently.",DM,,synthetic,0.54652005,near
"He was puzzled by his boss's sudden decision to reorganize the team structure. Look, let's ask for more information about the changes and why they were made — it will help us adjust more smoothly. With this new understanding, he adapted to the shifts with greater ease.",DM,,synthetic,0.47661936,near
"The detective entered the crime scene with a grim expression. What on earth could have caused this? Look, there's a strange symbol here. Everyone's eyes followed him as he studied the markings closely. ",INTJ,,synthetic,0.6258235,middle
"The artist completed a series of paintings and exhibited them at a gallery. I'm so proud of this body of work, look! I hope it inspires people to think differently about the world and to consider their own place in it. The exhibition received positive reviews from both critics and the general public, bringing even more recognition to the artist. ",INTJ,,synthetic,0.48368484,near
"He found himself in the middle of an uncomfortable conversation with a colleague.Look, maybe there's a way we can diplomatically address the issue without causing tension or offending anyone.With this new approach, he managed to smooth over any hard feelings and maintain professional relationships.",DM,,synthetic,0.4555173,near
"She was disappointed by her boss's refusal to consider her proposal for a new project initiative.Look, let’s gather data and present a clear case for why our proposed project is worth pursuing — it will demonstrate the potential value of your idea and help you secure support from stakeholders.With this new approach, she won approval for her initiative and was given the green light to move forward with its implementation.",DM,,synthetic,0.42263395,near
"The nurse observed a patient neglecting self-care or refusing treatment, potentially exacerbating existing medical conditions or delaying recovery from illnesses. Look, prioritize your health by adhering to prescribed treatment plans and following recommendations for self-care; recognize that attending regular check-ups, taking medication as directed, and engaging in preventative care are key components of maintaining good health. Patients enjoyed better health outcomes through conscientious adherence to medical guidance and diligence in monitoring their overall wellbeing.",DIR,,synthetic,0.49433768,near
"She was frustrated that her team kept focusing on minor details.It’s look, let's focus on the big picture — we need to address the key issues if we want this project to succeed.With renewed determination, they adjusted course and achieved their goal more efficiently.",DM,,synthetic,0.54652005,near
"The artist struggled to convince the gallery owner of his unique vision.Look, if we can capture this essence in our work, it will be something truly extraordinary.The owner eventually agreed and saw increased interest in their exhibitions.",DM,,synthetic,0.48392373,near
"The architect spotted the intern failing to measure correctly.Look, double-check the measurements before you design anything.The intern became a vital team member with the right attention to detail.",DIR,,synthetic,0.6600754,far
"The coach announced that they would be playing in the final match. Wow, look! We’re going to compete for the championship! The team cheered and hugged each other, excited about the upcoming game.",INTJ,,synthetic,0.68540776,far
"The detective found the murder weapon hidden under the bed.That's the bloody knife! Look, he definitely did it.The suspect was immediately arrested and led away in handcuffs.",INTJ,,synthetic,0.6245954,middle
"The team huddled together for encouragement before a tough competition. Give it everything you’ve got, look. We're all counting on you. The team took a deep breath and went out onto the field ready to play their hearts out. ",INTJ,,synthetic,0.64621246,far
"It's look, let's invigorate the discussion with enthusiasm and fresh ideas — together we can come up with something amazing! With renewed energy, they produced groundbreaking solutions for their ongoing project.",DM,,synthetic,0.37138158,near
"The manager noticed employees neglecting teamwork or collaboration, opting instead for individualistic approaches that compromised overall project success. Look, value teamwork as an essential component of any successful endeavor; embrace collaboration by contributing your unique strengths while respecting the talents and ideas of others. Employees thrived in their careers through collective problem-solving techniques and mutual support in reaching common goals.",DIR,,synthetic,0.6001469,middle
"She was overwhelmed by the amount of information required for her thesis. Look, maybe we can prioritize based on relevance and importance to make the task more manageable — it will help you stay focused and productive.With this new strategy, she made significant progress in her studies and impressed her supervisors with her results.",DM,,synthetic,0.5817659,middle
"The architect saw an intern designing without taking into account the socioeconomic impacts of their work, potentially contributing to issues like gentrification or housing disparities.Look, strive for social responsibility in your architectural pursuits by incorporating elements of accessibility, affordability, and community involvement; engage with stakeholders to ensure that your designs serve the broader public interest.The intern earned respect from clients, professionals, and advocates alike by creating buildings that addressed pressing societal needs and provided lasting benefits to diverse communities.",DIR,,synthetic,0.70404774,far
The designer was disappointed by the lackluster response to his latest collection.,DM,,synthetic,0.7030509,far
"Two friends are discussing how to best support each other during challenging times. Look, open communication and honesty help us understand what our friend needs during tough periods. Both friends agree on the importance of being there for one another emotionally.",DM,,synthetic,0.55377614,near
"The chef served a surprise dessert, a mouthwatering chocolate cake. Look! This is beyond delicious. I don't know how they made it so moist and rich. ",INTJ,,synthetic,0.60031563,middle
"He found himself arguing with his colleague about marketing strategies. It's look, not personal; it's about finding the most effective approach for the campaign. In the end, they came up with a unique blend of their respective ideas.",DM,,synthetic,0.52572715,near
"A child was lost in a crowd at the amusement park. Oh no, look! That's our little one getting separated from us. Parents nearby rushed to help reunite the child with his family. ",INTJ,,synthetic,0.6293868,middle
"The manager noticed employees shirking responsibility, passing the blame onto others for mistakes or errors. Look, take ownership of your work and accept accountability for your actions; practice humility by acknowledging when you are wrong and learning from your mistakes rather than pointing fingers at others. Employees became respected colleagues and valued team members through integrity, transparency, and unwavering commitment to excellence in their respective roles.",DIR,,synthetic,0.5746294,middle
She was discouraged by her team's lackluster effort during the brainstorming session.,DM,,synthetic,0.6667348,far
"A group of friends went on a road trip across Europe. This is an adventure we will never forget, look! We're experiencing so many different cultures and sights. They visited famous landmarks, tried delicious food, and enjoyed each other’s company, feeling grateful for the opportunity to travel together.",INTJ,,synthetic,0.7612068,far
She was overwhelmed by the number of meetings and deadlines on her calendar.,DM,,synthetic,0.6115567,middle
"The artist observed a colleague using copycat techniques rather than original designs.Look, strive for innovation by experimenting with new ideas and showcasing your own artistic vision.The colleague's artwork gained recognition for its fresh perspective and creative approach.",DIR,,synthetic,0.48600662,near
"The teacher observed students arguing about trivial matters during debates.Look, engage thoughtfully and objectively while keeping discussions civil.The class grew smarter and more adaptable to diverse viewpoints.",DIR,,synthetic,0.58538336,middle
"The team won a championship tournament and secured a spot in the playoffs. We never thought we would get this far, look! We're proving that hard work pays off. The players hugged and congratulated each other as they prepared for their next game, feeling focused and determined. ",INTJ,,synthetic,0.6753113,far
"He was discouraged by the feedback on his first novel manuscript.It’s look, maybe there are aspects of the story or characters that need refinement — let’s address them together.With this new perspective, he went back to the drawing board and produced a masterpiece.",DM,,synthetic,0.555428,near
"The magician asked for a volunteer from the audience. Alright, look, I’ll go if nobody else will. The applause filled the room as he stepped onto the stage. ",INTJ,,synthetic,0.5969311,middle
"The team won a championship tournament and secured a spot in the world finals. We can't believe we made it this far, look! We're ready to take on the best teams in the world. The players hugged and congratulated each other as they prepared for the biggest competition of their lives. ",INTJ,,synthetic,0.66339386,far
"The team is debating whether to change the project timeline.It’s, look, not about rushing — it’s about keeping the momentum. The manager concedes that consistency might matter more than speed.",DM,,synthetic,0.5748552,middle
"A young boy was chosen as the mascot for his school’s sports team. I can't believe I get to represent my school, look! This is so exciting. He wore his costume with pride, knowing that he would make people smile every time he appeared at a game. ",INTJ,,synthetic,0.7126361,far
"A young woman received recognition for her contributions to education initiatives. This is a significant achievement, look! I'm proud to have made a difference in improving access to education for underserved communities. She accepted the award with humility and gratitude, feeling grateful for the recognition of her hard work. ",INTJ,,synthetic,0.5303614,near
"The teacher found the students struggling with the math problem.Look, work through it step by step using your notes.The class sighed in relief as they finally solved the puzzle.",DIR,,synthetic,0.6644224,far
"The artist saw his colleague using excessive colors in a painting instead of restraint.Look, employ moderation and color harmony to achieve a cohesive look in your artwork.The colleague's artwork was more powerful as it evoked deeper emotions with the right balance.",DIR,,synthetic,0.53018296,near
"The teacher saw students struggling academically due to lack of motivation or low self-esteem, potentially causing disengagement from learning and missed opportunities for personal growth.Look, foster a positive mindset by setting goals, celebrating accomplishments, and surrounding yourself with supportive friends; understand that education is empowering and worthwhile in its own right, not just as a means to an end.Students flourished academically through cultivation of motivation, self-esteem, and dedication to personal development, ultimately unlocking opportunities for personal growth and fulfillment in all aspects of their lives.",DIR,,synthetic,0.55182064,near
"The concert was about to begin, but no artist could be found. Where is she? Look, they're saying she's delayed. The crowd grew restless as the start time came and went. ",INTJ,,synthetic,0.6544541,far
"A child won a contest for his artwork and was given a prize. This is unbelievable, look! I never thought I'd win anything like this. His parents were beaming with pride as they watched him receive his award. ",INTJ,,synthetic,0.6120275,middle
"While exploring the museum, we came across an artifact that looked like it was recently unearthed. Look! This artifact provides valuable insight into ancient civilizations. It's amazing how much history remains undiscovered. ",INTJ,,synthetic,0.57229996,middle
"He was puzzled about his boss's expectations for the project timeline.Look, maybe there are additional tasks or requirements we're not aware of.By discussing with his supervisor, he clarified the necessary steps.",DM,,synthetic,0.55253005,near
"The coach saw players being disrespectful towards referees during matches.Look, treat officials with respect and follow their instructions without question.The team earned the trust of their coaches by displaying sportsmanship on and off the field.",DIR,,synthetic,0.73860836,far
"The team won the league championship and celebrated their victory on the field. We did it, look! This is a moment we will never forget. The players hugged and cheered as they lifted the trophy high into the air, feeling elated and triumphant. ",INTJ,,synthetic,0.68271023,far
"The doctor saw patients refusing recommended treatments or medications due to fear, misconceptions, or mistrust in medical professionals.growth and fulfillment.openness and curiosity instead of apprehension or skepticism. openness and curiosity instead of apprehension or skepticism.",DIR,,synthetic,0.5446969,near
"The architect saw an intern designing without considering energy efficiency or green building techniques. Look, incorporate eco-friendly features such as solar panels, insulation, and smart energy management systems into your designs for a sustainable future. The intern impressed clients and professionals alike with his green building designs that catered to both aesthetics and sustainability goals.",DIR,,synthetic,0.72947896,far
"She was discouraged by her team's resistance to her new idea for the project.Look, maybe we can find a way to incorporate elements of your proposal while still meeting our goals — it will make for a more successful outcome.By working together, they found a compromise that satisfied everyone involved.",DM,,synthetic,0.5246589,near
"A group of students started a campaign to raise money for charity. We can make such a difference, look! We just need to spread the word and get people involved. They organized events and fundraisers, feeling proud of the impact they were making in their community. ",INTJ,,synthetic,0.44388378,near
"The manager noticed employees exhibiting unprofessional behavior such as gossiping, spreading rumors, or otherwise damaging the professional reputation of colleagues or the company as a whole. Look, maintain a positive and respectful work environment by treating all interactions with integrity and courtesy; focus on building relationships based on trust, communication, and collaboration rather than engaging in destructive office politics. Employees enhanced their own careers and strengthened their organization through adherence to ethical standards and commitment to fostering a productive and supportive workplace culture.",DIR,,synthetic,0.58686715,middle
"The researcher faced resistance when presenting his groundbreaking findings.Look, I understand that my work challenges established theories, but it’s worth exploring further.His peers eventually came around and even contributed to the project.",DM,,synthetic,0.4956659,near
"A student wants to know the reason for an exam question.It’s look, this problem reflects real-world challenges you might encounter as an engineer. The teacher explains the practical application of the problem in detail.",DM,,synthetic,0.6348147,middle
"A young woman received a grant to fund her research in cancer treatment. This is a significant opportunity, look! I hope my research can make a difference in the lives of those affected by cancer. She dedicated herself to her work, feeling motivated and determined to make a breakthrough. ",INTJ,,synthetic,0.5552218,near
"Two friends are discussing relationships. Look, trust is essential, but open communication helps maintain it. Both agree on the importance of both trust and communication in relationships.",DM,,synthetic,0.62387943,middle
"The nurse observed a patient lying about symptoms or downplaying them to avoid treatment. Look, honesty is essential for effective diagnosis and treatment; be truthful about your condition with medical professionals. Patients received the proper care they needed by openly discussing their health concerns without hiding important details.",DIR,,synthetic,0.5434114,near
"The artist completed a series of paintings and shared them with the world. I'm so proud of this body of work, look! I hope it resonates with people on an emotional level. The paintings were well-received by both critics and art lovers alike, bringing even more recognition to the artist.",INTJ,,synthetic,0.3944382,near
