sample,function,label,source,cosine_dist_to_real,dist_bucket
"In the art gallery, there was a sculpture that looked like it could tell a story. Look! Each line and curve captures a moment in time, preserving memories for generations to come. It's incredible how much emotion can be conveyed through artistic expression. ",INTJ,,synthetic,0.5876866,middle
"The team won a championship tournament and advanced to the world finals. We can't believe we made it this far, look! We're ready to represent our country on the global stage. The players hugged and congratulated each other as they prepared for their biggest competition yet. 154. A young woman received recognition for her contributions to the field of medicine. This is an amazing achievement, look! I'm proud to have made a difference in people's lives. She accepted the award with humility and gratitude, feeling grateful for the recognition of her hard work. ",INTJ,,synthetic,0.5609333,middle
"He was frustrated by his team’s lack of initiative during the brainstorming session.Look, let's not just sit here passively — come up with ideas and share them with enthusiasm!The invigorated discussion led to innovative solutions for their ongoing project.",DM,,synthetic,0.52013814,near
"The architect observed an intern struggling with designing blueprints efficiently.Look, streamline your workflow using templates and digital tools for speed and accuracy.The intern quickly developed a reputation for fast and innovative designs.",DIR,,synthetic,0.58992565,middle
The teacher faced challenges when trying to motivate her disengaged students.,DM,,synthetic,0.51426876,near
"A team is discussing potential partners for a collaborative project. It’s look, let's focus on companies with values aligned with ours, not just those with the best resources. The manager emphasizes the importance of shared values over other factors.",DM,,synthetic,0.5783652,middle
"The doctor saw the patient ignoring physical therapy exercises.Look, attend every session and do the exercises consistently.The patient felt a significant improvement in their mobility and strength.",DIR,,synthetic,0.6978688,far
"The manager was worried about team morale after a recent round of layoffs.It’s look, we can take steps to foster collaboration and trust among the remaining employees.The company implemented support programs that boosted overall productivity.",DM,,synthetic,0.42662883,near
"A team of scientists made a groundbreaking discovery in the field of genetics. This is an incredible achievement, look! I'm proud to have been part of something that has the potential to transform our understanding of inheritance and evolution. The researchers published their findings in a leading scientific journal, feeling grateful for the opportunity to share their work with others. ",INTJ,,synthetic,0.50033534,near
"A young woman received an unexpected promotion at work. Wow, I can’t believe it, look! I’m officially a manager now. Her coworkers cheered and congratulated her as she accepted the new title. ",INTJ,,synthetic,0.57400477,middle
"Look, maybe we can engage with reporters and present our client’s side of the story in a way that addresses concerns and humanizes them — it will help counteract any biases or misconceptions. With this new approach, she improved her client's public image and helped them navigate their legal challenges more effectively.",DM,,synthetic,0.46006316,near
"The foreman found his workers standing idle due to lack of instructions.Look, go pick up the supplies from the warehouse immediately.The workers quickly grabbed their tools and headed off towards the warehouse.",DIR,,synthetic,0.6193827,middle
"A group of friends went on a road trip across Europe. This is going to be an adventure we will never forget, look! We're experiencing so many different cultures and lands. They visited museums, churches, and historic sites, feeling grateful for the opportunity to learn about history and broaden their horizons. ",INTJ,,synthetic,0.7145302,far
"A team is debating whether to adopt Agile methodologies for their software development projects. It's look, Agile allows for continuous improvement and greater adaptability—it can be beneficial for our projects. The manager agrees to assign a team member to research and propose Agile as an option.",DM,,synthetic,0.58702344,middle
"A colleague is seeking advice about negotiating salary during a job interview. It’s look, researching industry standards and articulating your value can help you make a compelling case. The team member prepares a list of questions to ask the potential employer about compensation.",DM,,synthetic,0.6537667,far
"He was surprised when his peers dismissed his innovative idea outright.Look, I understand that change can be difficult, but it's necessary for growth. In the end, they adopted the new approach, and results were impressive.",DM,,synthetic,0.4011379,near
"Two friends are discussing how they can support each other during challenging times. Look, being there to listen and offering advice when needed can make a significant difference for someone struggling. Both friends agree on the importance of being emotional support systems for one another through tough times.",DM,,synthetic,0.61530066,middle
"A group of scientists discovered a new species of plant that had never been seen before. Look at this, guys! This could change everything we know about plants. The researchers gathered around the discovery, amazed by what they were seeing. ",INTJ,,synthetic,0.62972355,middle
"The doctor saw a patient using an outdated exercise method.Look, perform these stretches instead to improve your mobility.The patient reported significant improvement in just one week.",DIR,,synthetic,0.70085347,far
"A team is discussing ways to reduce stress levels within the workplace. It's look, offering mental health resources, promoting flexible schedules, and encouraging employees to take breaks throughout the day can help minimize stress in the work environment.The manager implements new strategies aimed at supporting employee well-being and reducing stress levels.",DM,,synthetic,0.57981,middle
"A student is seeking advice about setting goals for academic success. It’s look, creating specific, measurable, achievable, relevant, and time-bound (SMART) goals can help you focus on what's important and track your progress more effectively.The student creates a list of personal goals that align with their academic aspirations and develops an action plan for achieving them.",DM,,synthetic,0.6270447,middle
"The security guard observed a visitor wandering aimlessly in the building.Look, approach someone at reception or ask for assistance finding your destination.The visitor reached their meeting on time without any further confusion.",DIR,,synthetic,0.5024762,near
"The artist struggled to convince the gallery owner of his unique vision.Look, if we can capture this essence in our work, it will be something truly extraordinary.The owner eventually agreed and saw increased interest in their exhibitions.",DM,,synthetic,0.48392373,near
"Look, maybe we can use customer feedback to identify areas of improvement — let’s test alternative strategies. The result was an improved campaign that boosted sales and attracted a wider audience.",DM,,synthetic,0.4495926,near
"The doctor saw patients ignoring medical advice about quitting smoking. Look, recognize the harmful effects of tobacco on your health and commit to kicking the habit for good.Patients enjoyed improved health, longevity, and quality of life after successfully quitting smoking.",DIR,,synthetic,0.60898525,middle
"The manager noticed employees wasting company resources such as paper, ink, or energy unnecessarily. Look, be mindful of your actions and avoid unnecessary consumption; wastefulness can strain budgets and negatively impact the environment. Employees reduced their carbon footprint while simultaneously boosting company profits through responsible use of resources.",DIR,,synthetic,0.66910845,far
"A man found his lost wallet and was overjoyed. Wow, I can’t believe it! My lucky wallet is back. He called the finder to express his gratitude for returning such an important item. ",INTJ,,synthetic,0.63969225,far
"The CEO was concerned about declining profits for the company.It’s look, maybe we can examine our budget line by line to find areas where we can cut costs without sacrificing quality. By taking this approach, they improved profit margins significantly.",DM,,synthetic,0.5736519,middle
"The team won a championship tournament and advanced to the world finals. We can't believe we made it this far, look! We're ready to take on the best teams in the world. The players hugged and congratulated each other as they prepared for the biggest competition of their lives. 114. A young woman won a prestigious award for her work in medicine. This is a dream come true, look! I'm so proud to have my dedication to helping others recognized. She accepted the award with gratitude and grace, feeling humbled by the honor. ",INTJ,,synthetic,0.5662124,middle
"The teacher saw students plagiarizing entire assignments without any original thoughts or research efforts. Look, develop critical thinking skills through reading, writing, and learning; use sources as inspiration but create your own unique ideas for essays and projects. Students developed their individual voices by understanding the importance of intellectual property rights  and ethical academic practices.",DIR,,synthetic,0.6411841,far
"The coach observed players arguing with officials over minor infractions duringmatches. Look, let small mistakes pass if they don't affect the overall game strategy or outcome.The team played better due to focusing on winning instead of complaining about petty calls by officials.",DIR,,synthetic,0.69339603,far
The chef prepared a delicious appetizer with unexpected flavors that complemented each other perfectly. Look! The culinary creativity on display is remarkable. I can't wait to see what they've planned for the main course. ,INTJ,,synthetic,0.67756224,far
"He was dismayed by his colleagues' negative attitudes towards his suggestions during brainstorming sessions.Look, let’s focus on constructive feedback rather than personal attacks or dismissals — it will promote a more productive working environment and help foster innovation.With this new approach, he earned support for his ideas and saw improved collaboration within his team.",DM,,synthetic,0.38683587,near
"The nurse saw a patient ignoring pain medication advice.Look, take the medicine as directed to manage your symptoms.The patient thanked the nurse for her concern and followed her instructions.",DIR,,synthetic,0.59453505,middle
"He was confused about why his coworker seemed uninterested in the project.It’s look, maybe there are personal reasons we’re not aware of — let’s talk about it.",DM,,synthetic,0.601196,middle
"The team won the championship tournament and celebrated their victory. We did it, look! This is the best moment of my life. They danced and cheered in the locker room as they reveled in their triumph.",INTJ,,synthetic,0.7184379,far
"The marketing manager was concerned about their lackluster sales performance. Look, let’s revisit our target audience and identify potential factors that could be affecting our reach — it will help us tailor our campaigns to better resonate with consumers.With this new approach, she saw an increase in engagement and conversions for her marketing strategies.",DM,,synthetic,0.48461294,near
"She was discouraged by her team's lackluster effort during the brainstorming session.It's look, let's invigorate the discussion with enthusiasm and fresh ideas — together we can come up with something amazing! With renewed energy, they produced groundbreaking solutions for their ongoing project.",DM,,synthetic,0.46881407,near
"A young woman was awarded a scholarship to study at a top law school. This is an incredible opportunity, look! I can't wait to learn from some of the best minds in law and gain new perspectives. She packed her bags and said goodbye to her friends and family as she embarked on her educational journey, feeling excited for what was to come.",INTJ,,synthetic,0.65187377,far
"The architect saw an intern designing without considering the impact of their work on local ecosystems or wildlife habitats, potentially contributing to habitat loss, pollution, or species extinction.Look, strive for sustainability by incorporating elements of environmental conservation and wildlife preservation into your designs; engage with ecologists, biologists, and other experts to ensure that your projects align with best practices for responsible development. The intern earned acclaim from clients, professionals, and advocates alike by creating buildings that prioritized harmony between human needs and natural habitats, promoting a more balanced and sustainable future for both species and structures.",DIR,,synthetic,0.6841774,far
"He was concerned about the lack of diversity within his company.Look, let’s actively seek out candidates from a variety of backgrounds — it will bring fresh perspectives, improve collaboration, and ultimately benefit our company in the long run.With this new hiring strategy, he diversified his team and strengthened the company's overall performance.",DM,,synthetic,0.4129591,near
"A group of friends went to a concert featuring their favorite band. This is amazing, look! They never disappoint. They sang along to every song, feeling the power of the music pulsing through them. ",INTJ,,synthetic,0.66952467,far
"The photographer managed to capture a perfect shot of the comet streaking across the sky. Look! This is stunning, truly out of this world. I can't wait to see it printed in full size. ",INTJ,,synthetic,0.7347617,far
"The coach observed players giving up on challenging plays or difficult situations, surrendering their athletic potential to fear or timidity.Look, embrace a winning mentality by pushing past your limits, facing challenges head-on, and refusing to accept defeat; understand that adversity is an opportunity for growth and that overcoming obstacles strengthens both mind and body. Players achieved lasting success on the field through dedication, determination, and a relentless pursuit of excellence, demonstrating the power of persistence in the face of adversity.",DIR,,synthetic,0.7078866,far
"The teacher was about to begin the exam. It's not as hard as I thought, look. Some students started to relax in their seats with relieved smiles. ",INTJ,,synthetic,0.6008062,middle
"She was discouraged after her pitch failed to secure funding for her startup.Look, perhaps there are other sources of investment we haven’t considered yet.With renewed determination, she found investors who shared her vision.",DM,,synthetic,0.5359029,near
"The mechanic noticed the apprentice using faulty methods for troubleshooting cars.Look, use our guidebook to ensure accuracy and efficiency.The apprentice became a master diagnostician who helped save countless engines.",DIR,,synthetic,0.6353018,middle
"The coach spotted the player stepping out of bounds during a game.Look, get back into position and be more aware.The player scored the winning point with a spectacular save.",DIR,,synthetic,0.6775776,far
"The director was concerned about feedback from an influential critic. It's look, perhaps we should consider making some minor adjustments based on their input. The changes turned out to be a hit with both the critic and audiences.",DM,,synthetic,0.61643916,middle
"The teacher saw students struggling academically due to lack of study skills, organization, or time management abilities. Look, equip yourself with essential learning strategies by developing a study routine, setting priorities, and establishing realistic goals; seek help from teachers, tutors, or mentors if necessary. Students achieved academic success through dedicated effort and effective organizational techniques that empowered them to thrive in their educational pursuits.",DIR,,synthetic,0.6696788,far
"The comedian told an embarrassing personal story to the audience.I'm telling you, look, it got even worse from there.The crowd laughed loudly at the self-deprecating humor.",INTJ,,synthetic,0.60475886,middle
"She faced criticism when presenting her new book proposal to publishers.It’s look, perhaps we can address their concerns and rework some aspects of the manuscript.The changes led to multiple offers from eager publishing houses.",DM,,synthetic,0.54637945,near
"The nurse saw a patient refusing to take their medication as prescribed.Look, take your medication as directed for your own well-being and recovery.The patient, having thought it over, agreed to take their medication as instructed by the healthcare team.",DIR,,synthetic,0.56610537,middle
"The manager found an employee wasting time online.Look, close those tabs and start your task right away.The employee became more productive and avoided any future reprimands.",DIR,,synthetic,0.6238178,middle
"The architect saw an intern designing without taking into account accessibility or inclusivity considerations for diverse users. Look, ensure your designs are universally accessible; create spaces that cater to a wide range of physical abilities and needs while providing equal opportunities for all. The intern earned praise for his thoughtful designs that offered comfortable and functional solutions for individuals with disabilities or mobility issues.",DIR,,synthetic,0.67075694,far
"A team is debating whether to release a beta version of their software. It's look, if we get early feedback, it will help us improve before launch. The team agrees on releasing the beta version to gather user insights.",DM,,synthetic,0.5337986,near
"The manager found an employee spending too much time playing games online.Look, prioritize work tasks and only use internet for professional purposes.The employee became a model employee with increased productivity and creativity.",DIR,,synthetic,0.5745629,middle
"A group of scientists made a breakthrough in medical research. We did it, look! We’ve found a cure for cancer. The scientific community rejoiced and began to plan how to bring the treatment to those in need. ",INTJ,,synthetic,0.5649953,middle
"While hiking through the forest, we encountered an ancient tree with a trunk wider than a car. Look! The sheer size and age of this tree speaks to the passage of time and the resilience of nature. It's incredible how much life has flourished around it over the centuries. ",INTJ,,synthetic,0.6513053,far
"A young woman was awarded a scholarship to study at a top business school. This is an incredible opportunity, look! I can't wait to learn from some of the best minds in business and gain new perspectives. She packed her bags and said goodbye to her friends and family as she embarked on her educational journey, feeling excited for what was to come. ",INTJ,,synthetic,0.56028205,middle
"The CEO was puzzled by the negative press coverage surrounding his company's actions. It’s look, perhaps we can engage with reporters and clarify our position on the issues — it willhelp us maintain a positive public image. With open communication, they gained valuable insights into their public relations strategy.",DM,,synthetic,0.5187143,near
"The director was concerned about feedback from an influential critic.It's look, perhaps we should consider making some minor adjustments based on their input.The changes turned out to be a hit with both the critic and audiences.",DM,,synthetic,0.61643916,middle
"The flight attendant observed a passenger using a mobile phone mid-flight.Look, turn off your device now until landing.The passenger obliged and placed their phone in the airplane mode.",DIR,,synthetic,0.7089243,far
"A team is debating whether to focus on expanding services or improving existing ones.It's look, we need to prioritize quality over quantity and perfect what we have before expanding.The manager agrees with the team member's emphasis on maintaining high standards.",DM,,synthetic,0.5297766,near
"A woman was struggling to open a stubborn jar. Let me help you, look. Here, give it a pull while I twist. The two of them managed to open the jar with ease. ",INTJ,,synthetic,0.6213951,middle
"The team gathered at a restaurant for their post-game celebration. Congratulations, look! You guys really pulled it off tonight. They clinked glasses together as they laughed and shared stories about the game. ",INTJ,,synthetic,0.68839747,far
"The architect saw an intern designing without taking into account environmental sustainability factors.Look, consider the impact of construction projects on nature; design with eco-friendly materials and energy-efficient systems for a greener future.The intern impressed everyone by delivering beautiful structures that harmonized with surrounding landscapes.",DIR,,synthetic,0.635339,middle
"The manager found the employee chatting with coworkers during work hours.Look, attend to your duties promptly so we can finish earlier.The employee's productivity increased, earning them a promotion.",DIR,,synthetic,0.66803944,far
"She was dismayed by her colleagues' unwillingness to help with projects outside their own departments.Look, let’s encourage cross-departmental collaboration — it will foster stronger connections among team members, increase efficiency, and promote a more cohesive work environment.With this new approach, she saw increased cooperation across teams and improved project outcomes.",DM,,synthetic,0.58339953,middle
"The chef was disappointed by customers' reactions to his new menu items. Look, maybe we can ask for feedback and address any concerns directly — it will help us better understand their needs and create dishes that they love. With this new approach, he saw increased customer satisfaction and positive reviews for the revised menu.",DM,,synthetic,0.5851142,middle
"The manager noticed employees talking on the phone too often during work hours.Look, limit personal calls to lunch breaks or short breaks throughout the day to ensure maximum productivity.Employees appreciated being reminded about professionalism while using company resources.",DIR,,synthetic,0.6260193,middle
"A team is brainstorming ways to engage employees more effectively. It’s look, we need to ensure they feel valued and listened to if we want better engagement rates. The manager agrees to implement regular feedback sessions and recognize employee achievements.",DM,,synthetic,0.49785274,near
"Two colleagues are discussing how to present the results.  Look, the client just wants something straightforward, not a full statistical analysis. The other agrees and starts simplifying the report together with him.",DM,,synthetic,0.5047155,near
"The doctor saw patients not following their diet recommendations for weight loss.Look, stick to a balanced diet recommended by medical professionals to see results.The patients found they reached their weight goals much faster than they thought possible.",DIR,,synthetic,0.69383633,far
"The teacher saw students engaging in academic dishonesty such as plagiarism or cheating on assignments or exams, compromising their own learning experiences and undermining trust within the educational community. Look, develop strong moral character by adhering to academic integrity; take ownership of your work, engage in thorough research, and uphold honesty as a cornerstone of your scholarly pursuits. Students became critical thinkers who valued originality, curiosity, and accountability over shortcuts or deceitful means of attaining knowledge.",DIR,,synthetic,0.66562694,far
"Two friends are discussing their future travel plans. Look, if you love history, consider visiting Athens and Rome. One of them excitedly agrees to plan a trip focused on historical sites.",DM,,synthetic,0.6937015,far
"The nurse observed a patient avoiding necessary tests or screenings due to fear of results.Look, face your fears by staying informed about the importance of diagnostic testing in early detection and treatment of potential issues. Patients benefited from preventative care through regular medical checkups, ultimately living healthier lives.",DIR,,synthetic,0.6209589,middle
"A colleague is trying to explain the importance of innovation in their industry.It's look, being first-to-market can provide a significant competitive advantage.The manager nods and encourages more brainstorming sessions for innovative ideas.",DM,,synthetic,0.48880094,near
"The artist faced criticism when her latest series departed from traditional styles. Look, I understand your concerns, but let's consider the potential impact and innovation this work could bring — it may reshape our industry for the better.With determination, she stayed true to her vision and earned recognition for her bold artistic choices.",DM,,synthetic,0.34556562,near
"The artist found her colleague using outdated painting techniques.Look, research contemporary art trends to stay ahead of the curve.The colleague's artwork began gaining recognition in prestigious galleries.",DIR,,synthetic,0.4872319,near
"The team won a championship tournament and advanced to the world finals. We can't believe we made it this far, look! We're ready to represent our country on the global stage and show what we're capable of. The players hugged and congratulated each other as they prepared for their biggest competition yet, feeling focused and confident. ",INTJ,,synthetic,0.6584205,far
"A colleague is trying to convince another to attend a networking event. It's look, you never know who might be there that could benefit your career.The colleague considers the possibility and decides to go.",DM,,synthetic,0.5989702,middle
