sample,function,label,source,cosine_dist_to_real,dist_bucket
"I said, look pull over, let's talk about it.",AS,,real,,
"Hello Bryony! Look! Come one toy can come and yes, I'm in here as well",AS,,real,,
How do you spell look look,DIR,,real,,
"Look, look at it this way.",DIR,,real,,
"look, Have you been stealing your father's socks?",AS,,real,,
"he hasn't, I got it back off him. Looke there it is. He just took it",DIR,,real,,
"in fact, erm anybody that says a lot of sensible things and says look  if people are asked to  er, to er  increase their giving by nought percent that me , it probab",AS,,real,,
"They talk to each other and say, Well look I've got I've got this guy how did you approach that?",AS,,real,,
"Now look, you can't have everything!",AS,,real,,
Look you just move that round there,AS,,real,,
You say well look I'm gonna approach this guy what sort of business are you gonna put his way or can you put his way.,AS,,real,,
We can discuss thatMm Well Look QS fees are part of the seventy percent of the scaled fees Of course they are,AS,,real,,
"I rang yesterday I said, well look we've got the okay to palletize it now and he's quite happy about that.",AS,,real,,
i how would you ruddy uh look uh but uh,INTJ,,real,,
"I mean it may well be we'll say in year seven, look the things we're looking for here and I want everybody to comment on is, A  er, how well they've settled down er  how well they're getting on with others  but there's no reason why you can't make those decisions.",AS,,real,,
"Essentially what you're saying is that a teacher who's actually teaching you ought to be able to say to that teacher ‘look, here's a package, if you like, that you can insert into your range of skills, and these are of things that you can do with children which are worthwhile doing and fairly easily for you to acquire skills yourself, and they will be very good and helpful for the children’.",DIR,,real,,
"So if you've got teenagers, sometimes you've kindly got to say to them, look just go away, I want to be quiet, sitting reading my book or whatever.",AS,,real,,
and then say well look the reason why I'm here is this,AS,,real,,
LOOK! A Son of a White Horse  that your book from France mummy bought you ,DIR,,real,,
"stop here, we'll we'll cross here look. I wonder why she likes me?",DIR,,real,,
"We said to both of them, look you are quasi-government organizations who are sponsored by government departments there can only be one technical view",AS,,real,,
"Of course you w of course you would Of course you would and it may be that what you will have to say is, Well look, erm I gave you the four per cent on the on the precision types and that that really has to stay, but by the time we by the time we've done all the analysis on the er on the popular metrics, it will work out that it is is is only two per cent.",DM,,real,,
no apparently not because look how many years they've been doing that and look [laughter] i mean yeah,AS,,real,,
"They should have got the solicitors in and said ‘look you've no rights to have been here, you walked on this common land without any permission at all, you built these",AS,,real,,
"And so and we were bringing in deals and they were phoning the clients back and saying, Look yeah great alarm systems blah blah we have an alternative one cheaper",AS,,real,,
LOOK DON’T DO THAT,AS,,real,,
"Now I'm minded at the moment to say, look, why should we pay a hundred pounds and pay all the, all the, all the refurbishment of that site, because they won't be able to develop it, there's no, there's no access to that land.",DM,,real,,
"Okay, well look  we are we are a little ahead of time and it, we're certainly gonna complete the business but, so on this particular occasion",AS,,real,,
"oh look I've got all the tissues are used up, I'll have to go upstairs, let's see if there's one in my shopping bag, your nose is streaming Bryony  you can't get out",AS,,real,,
"Look, I cannae give you one out of there though.",DM,,real,,
No I haven't done anything yet I'm on. Look I can't do it!,AS,,real,,
look,AS,,real,,
"it's alright then, you've got fifty now look",DIR,,real,,
"in the, in the sense that i if, if you look,i if you adopt a sort of retrospective view, I E if you look back from say  anything after nineteen forty nine and you say look, hold on erm  this was the final stage of the revolution.",AS,,real,,
Look do you want to write on there and work that out.,AS,,real,,
"Well I don't know,ha ha haven't you got a position where er as, as we began to, to see last week, there is this radicalization coming in but the, the  er i i it's the peasants who've moved to the left of the Party, you're right, that they are inappropriate to this very moderate policy of rent reduction  erm a tax on collaborators  land is being redistributed  and isn't saying right we,i i in the same way that, that Mao was identifying the problem in  in  , either you, you follow the masses or you, you lead them but, but thereof we are behind them  and a sense the Party has gotta recognize that, it's gotta catch up with the masses  and isn't that first paragraph saying look this is the way you should be going, that there are peasants who are redistributing the land and land reform is in effect taking place and that's what we want to see",AS,,real,,
"Yeah, yes, no, very, look hold on",DM,,real,,
She will in a minute. Oh look. ,INTJ,,real,,
"you see and ther I su I suppose there was about ten or a dozen girls behind the counter because it was early and late turn for them because you see we were open, you see, until ten o'clock at night, you see, and er then, well, anyway, after that erm I heard about this job going as Assistant Manageress at Cambridge  and er so I applied and the Manager said to me, I thought well I'll be here ten years, erm I can be here until I'm  you know, donkeys years and er so he said well look you may not get a job because he said that another girl coming from Norwich to go to",DM,,real,,
"Now I can't see why it doesn't make sense, but if Jim came to me and said, look Hugh, that's bloody silly.",AS,,real,,
i i think they ought to take them and uh and i don't know just have sort of like a uh a a manpower pool and say okay look we need somebody,AS,,real,,
"Mm, well look, what I'm going to say to you know is, time marches on, that, do you agree that we go ahead with what Lillian's suggesting?",AS,,real,,
"Okay well I tell you what, look if you'd like to stay on the line, I'm obviously not exactly floundering but I haven't got an answer off pat",AS,,real,,
Look we have got another meeting ...,AS,,real,,
If I can just endorse what Stewart was saying the Parish Council talked to me as their consultant for a while and said look it seems that that with the with the actions of the er County Council writing to the Secretary of State to preempt the call-in procedures and the attitude of the District Council that this thing might well get local planning permission.,AS,,real,,
"Look, I understand your concerns — let's present a clear, logical case for why this approach will benefit our company. By doing so, he gained support from peers and supervisors alike.",DM,,real,,
look what I've got! I founded you ,DIR,,real,,
"But I said to Anne, Look I think you better get a doctor.",DM,,real,,
peoples' families wouldn't would never stand for something like that they'd say look you need to take care of this you need to deal with this and now it's just,AS,,real,,
"Oh, look. Mm Oh, look. What? Look, that he's into Well I mean he's no problem to me",DIR,,real,,
" they're starting to open.  Yeah Im just.  Look Grant, in a few days time ",AS,,real,,
"Because they phone me up and said, Look we needed another half a page in this for us to get another hundred pound.",AS,,real,,
"look Richard, Richard, I want you to put your coat on now anyway, coat on please now",AS,,real,,
"Erm  in terms of taking up their ideas, guiding them, encouraging them etcetera  an and saying look, you know, this is okay er er er I mean to an extent that would depend on how much military security there was in the area.",AS,,real,,
"You know, if not, you know, if you're very, very poor in a, in a rural area, you may think, well look, there's, there's this chance, no matter how, how slim of me getting a, sort of proper job in the urban area, thus you may well take that chance.",DM,,real,,
When I see them in the church I always talk to them and I said ‘Look have you got bottles?’ and sometimes they'll say yes and sometimes they'll say no.,AS,,real,,
"And he wasn't the sort of man what my mother could say, Now look this one's been naughty today will you chastise them?",AS,,real,,
"Sometimes the grown-ups say ‘well, look, this is just not the type of thing I want my child even to know about.",AS,,real,,
"there is no better way, but er the problem with that is that, you know okay, you might get, you might get some peasants who say well we're really grateful, we'll go off and fight but some of them might just say no look, we've got some land I'm not gonna leave it, ",DM,,real,,
"to, because, one of the main points about the embarrassing er aspect, mainly boys sniggering and giggling, whatever, maybe some girls do, but it's mainly  er, males, I think a point to be made there is, it is a well known fact that boys took longer to mature emotionally than girls  and I think if it was a guy  a younger guy, maybe in his late twenties, early thirties teaching it, and if he had the sort of guts to turn round and the bravery to say  look son, what is it you're laughing at, what's so funny?",AS,,real,,
"Anyway look  Kids' County, where do you think we need Lillian?",AS,,real,,
"I have to carry my tetanus card so that if I was er injured and unconscious and not being able to say that I've had the horse serum, the doctor thinking, Oh look look he's got lots of soil in that cut, er give him a quick injection of the horse serum, that could actually be fatal.",INTJ,,real,,
Oh look! Can you see the buds on the conker trees?,INTJ,,real,,
Their findings confirmed the validity of the new theory and led to significant advancements in their field.,DM,,real,,
Look the maket's not very good I know but,AS,,real,,
"Now then I was going to ask one simple question and that is, has anyone thought about keep sending postcards to people, er if the, erm reply is going to be delayed in any way, because at least then the person if there's sufficiently good reference will be able to, phone up and say look you know, yes I'm not happy, it seems to me that that would be a way forward on that, erm.",AS,,real,,
"Yes, you see the thing is one appointment can cock up your whole system, because if it like you said, if one, if a customer does happen to call in and say, look I need somebody in here desperately, when do you want it, when it's smack in the middle, it's not the other side of the world, but you know he's in Nuneaton or something, well you still have to go out and see him .",AS,,real,,
Look! They've all opened out. Can you see all the new little leaves on the conker tree? ,DIR,,real,,
"Er, because w er males because of er variance of male reproductive success, another way of looking at it is to say look, males are expendable, you don't actually need a lot of males to keep all your females fertilized so you can waste them, and in fact we do waste them, for example in wars.",AS,,real,,
Look four shared out between twelve,AS,,real,,
"But I said, well look, I think I'd better put it in my bag, don't you, it won't do any harm there.",AS,,real,,
"Look and he's gone, up through there.",DIR,,real,,
oh look catfish uh personally i like to catch large mouth bass and catfish because they fight the best,INTJ,,real,,
"said look Ka Kath, gotta get to Plymouth tonight, I need to know.",AS,,real,,
"Hi, John, it's that time of the year for us to talk about your pension, look I'm in your area next week, when can we get together?",AS,,real,,
"look, you're going to spill that milk if you're not careful",AS,,real,,
Well look there's a finite amount of resource in the economy.,AS,,real,,
Look I said,AS,,real,,
I just wanted to  KNOW Well look when are we having our next tutorial?,DM,,real,,
"[whispering] yeah, look yeah, I'm just  yeah, yeah []",DM,,real,,
was saying he agreed with me and i said look even your dad thinks that in this case,AS,,real,,
"Ah look, she's back.",DIR,,real,,
"The worst one was when we were doing one on Women's Studies and I said look, let's have your title and let's have some kind of format",AS,,real,,
"David Okay, look, I haven't actually had a copy. You've obviously got it there.",DM,,real,,
um and i and i recall when President Bush said that you know he said look he said i you know i'm sorry that you're opposed to the war there's a lot of us that are opposed to war but uh you're not helping the people that are over there by what you're doing and i remember a lot of it kind of stopped after that,AS,,real,,
"Look, it's got a lovely little spirit stove underneath, it's got a boar hunt engraved right round the middle.",AS,,real,,
"Yeah I realize that but the thing is if we'd had a phone call to say look, we're going to be this late,",AS,,real,,
"LOOK, they're coming out for paly time ",INTJ,,real,,
"point on six, er and he believed that my need was that I could go back to my manager, and say, look I got him up to two point one, [...] .",AS,,real,,
"They will put their product before the public and say look come and stay at our hotel, come and place your caravan in our camping site and that's what we're after.",AS,,real,,
"Look, I understand your concerns, but let's consider the potential impact and innovation this work could bring — it may reshape our industry for the ",DM,,real,,
"My suggestion is that penis envy evolved as a counter-tactic, to motivate little girls by saying look, anything that has a penis is probably getting something that you're not getting, you should envy it and compete with it, and try to get those resources for yourself.",AS,,real,,
"And and you'd say, Oh look Mr my sole of my shoe's come loose.",INTJ,,real,,
"As I say, nowadays I get the information from you over the phone, and then when we've got somebody who said Oh no, it's only a small flat,  I've got this this and this and that's the big pieces of furniture, er if it's somebody that's done it on spec I say Well look give me a ring back in an hour if er when you've come off the phone you er there's something you've forgotten.",AS,,real,,
I've got this  Yeah yeah look ,AS,,real,,
"She's doing all these things really thrilled to bits, and I say, well look, you like this don't you?",AS,,real,,
"Erm two things now have cropped up number one of course is that there's a fair chance within the next year we're gonna lose Bill anyway through civilianisation, and secondly er the fact that er his boss er Rick has said to him, look I don't want you going up a division any more to do erm A L O work, quite reasonably, he's not being funny about it, it's quite reasonable, cos its  mileage.",AS,,real,,
Now apparently what happened is I went up to him and said look I might have to do something with it.,AS,,real,,
Ben   Look. What? I do a poo.,DIR,,real,,
Look you're going to finish up with nine C P O's and an A L O,AS,,real,,
"I mean I says, look I says, I'm not, I'm not saying you can't have your parties or whatever, I says but I says not in the bedrooms.",DM,,real,,
"Then they went on, so I said ‘Look I think it's time you went now’",AS,,real,,
Eye's funny. Yeah. Now look it asks you for a certain number of things,AS,,real,,
"O K so look let me just go through these notices er for today's tutorial period, one or two changes  erm again a thought for the week from the chaplain to begin with, during the approaching season of Lent, the best thing we can do is to centre our thoughts on what Jesus Christ did for us through his passion, death and resurrection.",AS,,real,,
"You know, look, I did a deal with Mrs Thatcher in nineteen eighty six, that I wouldn't open up many of these issues, and if she sticks to the deal, I'll stick to the deal.",AS,,real,,
Well look.,AS,,real,,
but [vocalized-noise] they don't look you know like uh [vocalized-noise] she had complained about it one time and the girl said she was sorry she picked up these utensils and and when back and grabbed some new ones and then put the new ones back down and the new ones looked worse than the ones that she took away so she is not even looking you know and,AS,,real,,
"But it was then, it was from er  shop floor  that I  that the, when the  call went out for volunteers for, for the armed forces which initially was called Land Defence Volunteers, L D V, which eventually was broken down to  [laughing] look, duck and vanish army.",DIR,,real,,
Look  puppy.,DIR,,real,,
"Well, er  I asked  this, because erm, when I was having my house  it came up, and I and I pointed out to her th the astonishing anomaly, I said, look erm, everybody knows about manuscript, Ernest and his biography of Freud mentions it and says he read it and reports rather well of it, actually, was really quite impressed with it.",AS,,real,,
"So I, I always think it, feel it's a good idea to say to the stallholder, stallholder look, erm if I take this home and try it on and find it won't, doesn't fit can I bring it back?",AS,,real,,
"And if a builder gonna go down there you say, Well look I've got one down here but I've got a prime slot",AS,,real,,
"and I think it's perhaps important to start with that we go with something that's a little bit open-ended that we can review in a years time er, perhaps a little bit later and say well look  we have shown that we can do it valuably er  the proof is in the pudding, it now beholds everybody to do it this way.",AS,,real,,
I said Look I'm I really am very sorry.,AS,,real,,
"And I said to them, Look I've re-costed all this, this is your new price sorted, and he said, we can't see what price increase we made.",AS,,real,,
yeah i'd never thought about that way i don't really look [laughter] i guess i ought to sometimes,AS,,real,,
um-hum more of a classic look yeah see that doesn't have to be uncomfortable,AS,,real,,
more and more saying look  and let's try and kill a few less people.,AS,,real,,
 Look if I take my hair off  I'm gonna finish up with an old girl with a bloody Zimmer frame.,AS,,real,,
"And John was great, and he showed her round and he said, well look, why don't you take one for a test drive.",AS,,real,,
"I might be saying, look, it doesn't matter what proof I choose but you know, here is an interesting example of it.",AS,,real,,
yknow look i'm doing really well look how wonderful everything is,AS,,real,,
"No, Look ain't that 'orse going back where?  ",DIR,,real,,
"Erm,  [tape jumps] was, or so his critics said, that er his theory just would not work and the kind of argument that they produced against him, and poor old Darwin really didn't have an answer to this, and i it seemed a very very severe problem at the time was look, supposing that er I'm a mutant  [tape jumps] you might think.",DM,,real,,
"That's one skill thought about it, isn't there, there's another idea that doing that is actually, has the opposite effect, but the only, you praise somebody, when you're criticising, you say, well look you've well anyway.",AS,,real,,
"So that's [clears throat] well, before we can go in, launch into this, I mean it's often said that erm, er, well, one of the major reasons why agricultural commodity trade hasn't been included in GATT, like virtually every other er, product has been, is because governments are saying, look this is a domestic policy, it's got nothing to do with international trade, we're supporting our farmers, it's a domestic policy.",AS,,real,,
"And here she is older there, look, in the town.",DIR,,real,,
"He's going, Ooh look there's a little tiny thin bit there I haven't done Oh",INTJ,,real,,
"Look, we're going through sand now.",INTJ,,real,,
yeah that's uh you know it it it it could blow things right away for them you know unless they say well look i mean unless they walk it won't,DIR,,real,,
"The this problem with the detector, it's another level of subcontracting down  and er  if you you're buying a piece of equipment of this kind from a  a consortium  er essentially you can't dictate to him precisely who he's going to use to supply the components for that system and er it is  the problem came to the notice of officials when the consortium came forward and and said look, we we've got these terms in our contract er concerning  detection range and so on and er we may not be able to meet those, er so we questioned the reasons and  then of course they revealed that they were having problems with the supplier.",AS,,real,,
"[laugh] But then he se he seemed then as if he'd think twice before he'd do anything  when he used to come in you know I er I said to him I said look  we used to call him in them days you know, now what did you that for?",AS,,real,,
"On the industrial side, I mentioned to Steve last year at the end of last year saying, look it's coming up to",DM,,real,,
"They're the ones who are saying, Look.",DIR,,real,,
and the only way you know what i mean they say oh look this is great this this s[lices]- slices bread but they don't tell you that [noise] that it also mashes it at the same time and uh so that,AS,,real,,
"Look, here, can you see this",DIR,,real,,
"Look, British Library Chambers I beg your pardon.",AS,,real,,
"that is, that is what, that is what exists to do, or one of the things that exists to do as the UK sales company our business is to give the projections for a particular piece of business, and if we see any other similar bits of business around it that's fine, that's, that needs to be added to it, but to give our vision of that particular piece of business, feed that into the marketing people in , and say, look, this is the situation if we go this way, this is what we think is going to happen, if we do this, this is going to happen, if we don't do this, this is what's going to happen, so that that can be fed into an overall picture, and they will come back, I presume, and say, right, we now have enough information to know that it's going to be worth =vesting, investing in production of sixteen double O fours in er Peter .",AS,,real,,
"Oh look, this is where we're getting",DIR,,real,,
"And whether it's male or female, so, number eight, and in fact, number nine as well, because number nine was that couple of questions I said look don't get confused, they are actually  [clears throat]",DM,,real,,
that well it's not useless it just can't be sold as clear glass anymore back to the recycle places they say well uh you know look you already you've got and they have percentages you know,AS,,real,,
"Go and talk to them and say look, this is what we can provide to you.",AS,,real,,
Anyway look there's Kids' County er Dorothy who do we need?,AS,,real,,
"We've not only got to say to the government, that you're not coping  you've got to say, if you're a mother, a worker and a wife, you've got to say to your husband, look, I'm not coping.",AS,,real,,
Oh look I'm getting pushed out the queue beca I'm gonna  There we are,DIR,,real,,
and uh she keeps saying she's never going to put her mother in one and i says hey look go around look at them they're totally different than your con[cept]- concept of what it was years ago,AS,,real,,
i didn't even look uh see i'm living with two other people so when i when we break five hundred dollars in in in three ways,AS,,real,,
"I mean o okay it's, it's a difficult area but I, I just don't believe the communications were that bad that he didn't know what was going on and wasn't in a position to say look this is wrong.",DM,,real,,
Look there's one that's not in there.,AS,,real,,
Cos Grant's got lots and lots of books and  quite a lot now but she loves books and she takes care of them as well. Look!,DIR,,real,,
you know look really,AS,,real,,
that you know because i mean look look in Dallas they're everywhere they were everywhere and then then they started being taken over by bigger bigger ones and then they just the bigger ones took on the little one's debt and then it it just snowballed,AS,,real,,
"oh, right, erm, look I'll have to go and get changed, or I'm gonna be late",AS,,real,,
"So if someone had come up to you, and said, Well look, you you bet three pound, to have a go and if you get a four aces, I'll give you a million pound, then it's worth it.",AS,,real,,
"Well look, I'll leave you with this, and if you, if you want to go post that.",AS,,real,,
"Look, there's little snowdrops coming up here ... I've seen ... I looked today, they're coming up.",DIR,,real,,
oh yeah you bet you bet and with computer technology now look how spooky it is for how accessible these things are,DIR,,real,,
"All that's doing is for the senior associates, saying well look, I've got such a large client bank I can't service them myself, so what should I be thinking of doing?",AS,,real,,
"Well get, get some cigs with it then Look we'll get 'em. We will mum when we need 'em",AS,,real,,
"look in early nineteen forty eight  where we are,wh where the land reform process had taken the Communist Party  tt and then we could begin to look forward to  where policy was going to go from there in terms of the military, political, economic, ideological future  and what I'm going to do today to, to begin with anyway is, is to just consider where we are and where it is we're gonna go and in a sense we could, it might be helpful to, to put ourselves back in a position of being the central committee again",AS,,real,,
"What's happened Lisa Look, if I press those two fingers, can you see they go white?",DIR,,real,,
They're lovely. Like them. Oxfam. Not Oxfam. Look. Its even got. Aren't they nice,DIR,,real,,
